rating,books,movies,updated,created,text
"{'rate': 1, 'label': 'ONE'}","[{'id': None, 'metadata': {'title': 'CARRION COMFORT', 'pages': 'unknown'}}]","[{'id': 0, 'title': 'end'}, {'id': 0, 'title': 'THE LIVES OF OTHERS'}]",2021-12-26T06:48:43.317+0100,2021-12-17T04:36:38.905+0100,Vitium alienus cupiditas. Abscido nulla vado.
"{'rate': 4, 'label': 'FOUR'}","[{'id': None, 'metadata': {'title': 'THE MAN WITHIN', 'pages': 'unknown'}}]","[{'id': 0, 'title': 'THE USUAL SUSPECTS'}, {'id': 0, 'title': 'end'}]",2021-12-03T08:19:17.376+0100,2021-12-28T01:43:31.846+0100,Deorsum cinis tredecim. Super demo tum.
"{'rate': 4, 'label': 'FOUR'}","[{'id': None, 'metadata': {'title': 'MANY WATERS', 'pages': 'unknown'}}]","[{'id': 0, 'title': 'HOW TO TRAIN YOUR DRAGON'}, {'id': 0, 'title': 'end'}]",2021-12-27T18:24:59.271+0100,2021-12-22T02:55:50.168+0100,Adamo caput eos. Depromo est ullam.
"{'rate': 5, 'label': 'FIVE'}","[{'id': None, 'metadata': {'title': 'CARRION COMFORT', 'pages': 'unknown'}}]","[{'id': 0, 'title': 'end'}, {'id': 0, 'title': 'BEFORE SUNRISE'}]",2021-12-01T04:00:51.470+0100,2021-12-05T12:00:28.740+0100,Torqueo ut et. Cras crebro uter.
"{'rate': 5, 'label': 'FIVE'}","[{'id': None, 'metadata': {'title': 'AN EVIL CRADLING', 'pages': 'unknown'}}]","[{'id': 0, 'title': 'end'}, {'id': 0, 'title': 'PLATOON'}]",2021-12-06T14:11:39.894+0100,2021-12-20T18:03:16.691+0100,Aggredior auctus vaco. Dignissimos absens neque.
"{'rate': 4, 'label': 'FOUR'}","[{'id': None, 'metadata': {'title': 'ALONE ON A WIDE, WIDE SEA', 'pages': 'unknown'}}]","[{'id': 0, 'title': 'end'}, {'id': 0, 'title': 'JURASSIC PARK'}]",2021-12-27T21:49:44.496+0100,2021-12-28T06:28:50.731+0100,Vacuus thesaurus trans. Corona cognomen curso.
"{'rate': 2, 'label': 'TWO'}","[{'id': None, 'metadata': {'title': 'ALONE ON A WIDE, WIDE SEA', 'pages': 'unknown'}}]","[{'id': 0, 'title': 'end'}, {'id': 0, 'title': 'DEAD POETS SOCIETY'}]",2021-12-24T06:33:39.237+0100,2021-12-08T10:57:00.787+0100,Decumbo tui sublime. Qui currus attonbitus.
"{'rate': 5, 'label': 'FIVE'}","[{'id': None, 'metadata': {'title': 'THE LAST TEMPTATION', 'pages': 'unknown'}}]","[{'id': 0, 'title': 'end'}, {'id': 0, 'title': 'TOY STORY 3'}]",2021-12-18T14:02:26.513+0100,2021-12-01T20:04:53.248+0100,Quaerat thalassinus vulticulus. Vigor uxor est.
"{'rate': 4, 'label': 'FOUR'}","[{'id': None, 'metadata': {'title': 'IF I FORGET THEE JERUSALEM', 'pages': 'unknown'}}]","[{'id': 0, 'title': 'end'}, {'id': 0, 'title': 'TOY STORY 2'}]",2021-12-01T23:15:10.203+0100,2021-12-05T12:29:34.452+0100,Abeo vix casso. Voco comedo arceo.
"{'rate': 1, 'label': 'ONE'}","[{'id': None, 'metadata': {'title': 'SURPRISED BY JOY', 'pages': 'unknown'}}]","[{'id': 0, 'title': 'end'}, {'id': 0, 'title': 'GONE WITH THE WIND'}]",2021-12-03T09:03:25.915+0100,2021-12-05T03:07:07.900+0100,Villa clam vapulus. Quis textilis subnecto.
"{'rate': 4, 'label': 'FOUR'}","[{'id': None, 'metadata': {'title': 'WAITING FOR THE BARBARIANS', 'pages': 'unknown'}}]","[{'id': 0, 'title': 'THE GODFATHER'}, {'id': 0, 'title': 'end'}]",2021-12-11T10:04:42.426+0100,2021-12-29T15:18:46.342+0100,Sumptus tabgo cervus. Decens adhaero administratio.
"{'rate': 2, 'label': 'TWO'}","[{'id': None, 'metadata': {'title': 'THE WEALTH OF NATIONS', 'pages': 'unknown'}}]","[{'id': 0, 'title': 'RUSH'}, {'id': 0, 'title': 'end'}]",2021-12-08T06:55:24.403+0100,2021-12-23T13:00:57.431+0100,Curvo creta capitulus. Arcus vestrum aperte.
"{'rate': 3, 'label': 'THREE'}","[{'id': None, 'metadata': {'title': 'FAME IS THE SPUR', 'pages': 'unknown'}}]","[{'id': 0, 'title': 'end'}, {'id': 0, 'title': 'STALKER'}]",2021-12-12T10:43:39.094+0100,2021-12-09T23:06:16.344+0100,Triduana aut vero. Appello addo tubineus.
"{'rate': 2, 'label': 'TWO'}","[{'id': None, 'metadata': {'title': 'WHERE ANGELS FEAR TO TREAD', 'pages': 'unknown'}}]","[{'id': 0, 'title': 'end'}, {'id': 0, 'title': 'STAR WARS: EPISODE VIII – THE LAST JEDI'}]",2021-12-12T11:03:09.528+0100,2021-12-17T11:12:09.605+0100,Acervus pecto coerceo. Aspernatur terga decor.
"{'rate': 5, 'label': 'FIVE'}","[{'id': None, 'metadata': {'title': 'CARRION COMFORT', 'pages': 'unknown'}}]","[{'id': 0, 'title': 'TO KILL A MOCKINGBIRD'}, {'id': 0, 'title': 'end'}]",2021-12-07T11:19:23.782+0100,2021-12-01T18:22:55.178+0100,Ventito carpo vero. Certus aegrotatio spiritus.
"{'rate': 2, 'label': 'TWO'}","[{'id': None, 'metadata': {'title': 'TENDER IS THE NIGHT', 'pages': 'unknown'}}]","[{'id': 0, 'title': 'end'}, {'id': 0, 'title': 'PLATOON'}]",2021-12-25T15:17:33.793+0100,2021-12-01T00:58:40.517+0100,Corona aptus vulariter. Conscendo qui causa.
"{'rate': 2, 'label': 'TWO'}","[{'id': None, 'metadata': {'title': 'BURY MY HEART AT WOUNDED KNEE', 'pages': 'unknown'}}]","[{'id': 0, 'title': 'IT HAPPENED ONE NIGHT'}, {'id': 0, 'title': 'end'}]",2021-12-23T17:26:59.318+0100,2021-12-06T18:35:54.301+0100,Ter aqua vestrum. Vita labore agnosco.
"{'rate': 1, 'label': 'ONE'}","[{'id': None, 'metadata': {'title': 'THE WORLD, THE FLESH AND THE DEVIL', 'pages': 'unknown'}}]","[{'id': 0, 'title': 'end'}, {'id': 0, 'title': 'ONCE UPON A TIME IN AMERICA'}]",2021-12-22T19:16:23.374+0100,2021-12-24T13:06:39.027+0100,Cruentus ex varietas. Thermae vulpes pax.
"{'rate': 1, 'label': 'ONE'}","[{'id': None, 'metadata': {'title': 'ENDLESS NIGHT', 'pages': 'unknown'}}]","[{'id': 0, 'title': 'end'}, {'id': 0, 'title': 'SOME LIKE IT HOT'}]",2021-12-24T09:38:30.402+0100,2021-12-01T10:39:51.384+0100,Taedium aqua tamen. Taceo aegre adiuvo.
"{'rate': 1, 'label': 'ONE'}","[{'id': None, 'metadata': {'title': 'THINGS FALL APART', 'pages': 'unknown'}}]","[{'id': 0, 'title': 'CASABLANCA'}, {'id': 0, 'title': 'end'}]",2021-12-09T03:04:08.342+0100,2021-12-23T21:36:17.208+0100,Ventosus nisi adfero. Magni bos civitas.
"{'rate': 2, 'label': 'TWO'}","[{'id': None, 'metadata': {'title': 'BLITHE SPIRIT', 'pages': 'unknown'}}]","[{'id': 0, 'title': 'COOL HAND LUKE'}, {'id': 0, 'title': 'end'}]",2021-12-27T10:58:30.314+0100,2021-12-25T18:09:22.550+0100,Paens succedo deludo. Desparatus tum cado.
"{'rate': 4, 'label': 'FOUR'}","[{'id': None, 'metadata': {'title': 'THE WORLD, THE FLESH AND THE DEVIL', 'pages': 'unknown'}}]","[{'id': 0, 'title': 'end'}, {'id': 0, 'title': 'V FOR VENDETTA'}]",2021-12-19T15:30:52.278+0100,2021-12-16T05:33:23.529+0100,Odit necessitatibus succedo. Et desino stipes.
"{'rate': 2, 'label': 'TWO'}","[{'id': None, 'metadata': {'title': 'GONE WITH THE WIND', 'pages': 'unknown'}}]","[{'id': 0, 'title': 'end'}, {'id': 0, 'title': 'BLADE RUNNER'}]",2021-12-29T19:30:30.164+0100,2021-12-12T20:50:59.177+0100,Amissio nesciunt quisquam. Angelus torrens adamo.
"{'rate': 4, 'label': 'FOUR'}","[{'id': None, 'metadata': {'title': 'THINGS FALL APART', 'pages': 'unknown'}}]","[{'id': 0, 'title': 'end'}, {'id': 0, 'title': 'DEAD POETS SOCIETY'}]",2021-12-26T16:03:46.982+0100,2021-12-05T17:53:37.251+0100,Minima cursus stabilis. Cervus curtus temptatio.
"{'rate': 3, 'label': 'THREE'}","[{'id': None, 'metadata': {'title': ""THE MONKEY'S RAINCOAT"", 'pages': 'unknown'}}]","[{'id': 0, 'title': 'end'}, {'id': 0, 'title': 'STALKER'}]",2021-12-01T09:45:15.158+0100,2021-12-24T00:49:42.556+0100,Repellat tristis suppono. Angelus testimonium repellat.
"{'rate': 2, 'label': 'TWO'}","[{'id': None, 'metadata': {'title': 'TENDER IS THE NIGHT', 'pages': 'unknown'}}]","[{'id': 0, 'title': 'end'}, {'id': 0, 'title': 'A BEAUTIFUL MIND'}]",2021-12-23T11:17:49.339+0100,2021-12-19T06:21:39.003+0100,Aedificium est cur. Uterque cupiditate cupressus.
"{'rate': 3, 'label': 'THREE'}","[{'id': None, 'metadata': {'title': 'THE PARLIAMENT OF MAN', 'pages': 'unknown'}}]","[{'id': 0, 'title': 'end'}, {'id': 0, 'title': 'SUNRISE: A SONG OF TWO HUMANS'}]",2021-12-17T13:12:49.744+0100,2021-12-29T16:50:35.742+0100,Desipio perferendis cum. Tepidus arbor veritatis.
"{'rate': 5, 'label': 'FIVE'}","[{'id': None, 'metadata': {'title': 'IN DEATH GROUND', 'pages': 'unknown'}}]","[{'id': 0, 'title': 'GRAN TORINO'}, {'id': 0, 'title': 'end'}]",2021-12-24T23:31:19.181+0100,2021-12-24T13:35:39.718+0100,Repellendus super carbo. Trans cohibeo paens.
"{'rate': 4, 'label': 'FOUR'}","[{'id': None, 'metadata': {'title': 'ARMS AND THE MAN', 'pages': 'unknown'}}]","[{'id': 0, 'title': 'end'}, {'id': 0, 'title': 'STALKER'}]",2021-12-06T22:05:31.574+0100,2021-12-08T20:19:12.875+0100,Bibo volo ceno. Vultuosus qui admoneo.
"{'rate': 2, 'label': 'TWO'}","[{'id': None, 'metadata': {'title': 'HAVE HIS CARCASE', 'pages': 'unknown'}}]","[{'id': 0, 'title': 'end'}, {'id': 0, 'title': 'INTERSTELLAR'}]",2021-12-08T08:35:33.974+0100,2021-12-02T22:08:50.224+0100,Vulgo stipes paulatim. Decumbo alias timor.
"{'rate': 1, 'label': 'ONE'}","[{'id': None, 'metadata': {'title': 'THAT GOOD NIGHT', 'pages': 'unknown'}}]","[{'id': 0, 'title': 'RAGING BULL'}, {'id': 0, 'title': 'end'}]",2021-12-01T05:24:28.774+0100,2021-12-18T08:44:10.099+0100,Ea viscus despirmatio. Caput attonbitus succurro.
"{'rate': 3, 'label': 'THREE'}","[{'id': None, 'metadata': {'title': 'THE GOLDEN BOWL', 'pages': 'unknown'}}]","[{'id': 0, 'title': 'SHUTTER ISLAND'}, {'id': 0, 'title': 'end'}]",2021-12-11T09:22:47.227+0100,2021-12-30T08:53:32.385+0100,Cohors corona thymum. Aegrotatio atavus sunt.
"{'rate': 2, 'label': 'TWO'}","[{'id': None, 'metadata': {'title': 'MANY WATERS', 'pages': 'unknown'}}]","[{'id': 0, 'title': 'end'}, {'id': 0, 'title': 'STAR WARS: EPISODE VII - THE FORCE AWAKENS'}]",2021-12-17T09:36:12.034+0100,2021-12-03T04:14:08.992+0100,Acervus antea viriliter. Abeo utpote facilis.
"{'rate': 5, 'label': 'FIVE'}","[{'id': None, 'metadata': {'title': 'THE PAINTED VEIL', 'pages': 'unknown'}}]","[{'id': 0, 'title': 'end'}, {'id': 0, 'title': 'ONCE UPON A TIME IN THE WEST'}]",2021-12-20T02:27:41.806+0100,2021-12-14T18:30:26.545+0100,Supra annus auctus. Stips sophismata cattus.
"{'rate': 4, 'label': 'FOUR'}","[{'id': None, 'metadata': {'title': 'THE GOLDEN BOWL', 'pages': 'unknown'}}]","[{'id': 0, 'title': 'end'}, {'id': 0, 'title': 'STAR WARS: EPISODE V - THE EMPIRE STRIKES BACK'}]",2021-12-21T08:07:35.176+0100,2021-12-21T00:49:53.289+0100,Tres veritatis tum. Viscus cariosus corpus.
"{'rate': 1, 'label': 'ONE'}","[{'id': None, 'metadata': {'title': 'TO YOUR SCATTERED BODIES GO', 'pages': 'unknown'}}]","[{'id': 0, 'title': 'end'}, {'id': 0, 'title': 'SCARFACE'}]",2021-12-27T16:19:37.020+0100,2021-12-02T13:47:23.704+0100,Caritas pariatur patrocinor. Causa vilicus aequus.
"{'rate': 2, 'label': 'TWO'}","[{'id': None, 'metadata': {'title': 'THE YELLOW MEADS OF ASPHODEL', 'pages': 'unknown'}}]","[{'id': 0, 'title': 'THERE WILL BE BLOOD'}, {'id': 0, 'title': 'end'}]",2021-12-12T20:32:49.736+0100,2021-12-07T04:38:51.162+0100,Tredecim depono tunc. Contra combibo trado.
"{'rate': 4, 'label': 'FOUR'}","[{'id': None, 'metadata': {'title': 'WHEN THE GREEN WOODS LAUGH', 'pages': 'unknown'}}]","[{'id': 0, 'title': 'THE APARTMENT'}, {'id': 0, 'title': 'end'}]",2021-12-16T03:41:47.114+0100,2021-12-27T03:10:28.207+0100,Arto iste considero. Curvo conservo curatio.
"{'rate': 3, 'label': 'THREE'}","[{'id': None, 'metadata': {'title': 'FOR WHOM THE BELL TOLLS', 'pages': 'unknown'}}]","[{'id': 0, 'title': 'end'}, {'id': 0, 'title': 'THE KID'}]",2021-12-20T06:21:20.167+0100,2021-12-06T22:14:12.801+0100,Eaque uredo cenaculum. Validus tutamen compello.
"{'rate': 5, 'label': 'FIVE'}","[{'id': None, 'metadata': {'title': 'THE GOLDEN BOWL', 'pages': 'unknown'}}]","[{'id': 0, 'title': 'end'}, {'id': 0, 'title': 'STAR WARS: EPISODE III – REVENGE OF THE SITH'}]",2021-12-14T17:02:01.507+0100,2021-12-26T20:43:34.296+0100,Triduana ea bene. Tactus suffragium sollers.
"{'rate': 5, 'label': 'FIVE'}","[{'id': None, 'metadata': {'title': 'TO SAY NOTHING OF THE DOG', 'pages': 'unknown'}}]","[{'id': 0, 'title': 'PRISONERS'}, {'id': 0, 'title': 'end'}]",2021-12-06T13:51:05.485+0100,2021-12-21T20:15:17.049+0100,Admiratio derelinquo celebrer. Aedificium acsi pax.
"{'rate': 2, 'label': 'TWO'}","[{'id': None, 'metadata': {'title': 'NO LONGER AT EASE', 'pages': 'unknown'}}]","[{'id': 0, 'title': 'end'}, {'id': 0, 'title': 'TOY STORY'}]",2021-12-13T12:54:02.823+0100,2021-12-29T10:01:14.326+0100,Maiores aliqua similique. Coepi deripio vita.
"{'rate': 2, 'label': 'TWO'}","[{'id': None, 'metadata': {'title': 'THE OTHER SIDE OF SILENCE', 'pages': 'unknown'}}]","[{'id': 0, 'title': 'INGLOURIOUS BASTERDS'}, {'id': 0, 'title': 'end'}]",2021-12-08T09:59:41.019+0100,2021-12-10T00:14:54.280+0100,Peior qui nisi. Suus delibero defleo.
"{'rate': 4, 'label': 'FOUR'}","[{'id': None, 'metadata': {'title': 'THE LITTLE FOXES', 'pages': 'unknown'}}]","[{'id': 0, 'title': 'STAR WARS: EPISODE III – REVENGE OF THE SITH'}, {'id': 0, 'title': 'end'}]",2021-12-01T21:42:33.465+0100,2021-12-17T23:13:50.834+0100,Quidem venio curis. Eos aureus triduana.
"{'rate': 4, 'label': 'FOUR'}","[{'id': None, 'metadata': {'title': 'BURY MY HEART AT WOUNDED KNEE', 'pages': 'unknown'}}]","[{'id': 0, 'title': 'end'}, {'id': 0, 'title': 'TO KILL A MOCKINGBIRD'}]",2021-12-10T22:15:15.824+0100,2021-12-24T19:23:08.896+0100,Non curatio dicta. Id constans capillus.
"{'rate': 3, 'label': 'THREE'}","[{'id': None, 'metadata': {'title': 'MANY WATERS', 'pages': 'unknown'}}]","[{'id': 0, 'title': 'end'}, {'id': 0, 'title': 'THE PIANIST'}]",2021-12-22T16:45:56.720+0100,2021-12-21T08:37:45.831+0100,Id abduco venustas. Sortitus porro non.
"{'rate': 4, 'label': 'FOUR'}","[{'id': None, 'metadata': {'title': 'GONE WITH THE WIND', 'pages': 'unknown'}}]","[{'id': 0, 'title': 'end'}, {'id': 0, 'title': 'CASABLANCA'}]",2021-12-11T02:13:26.487+0100,2021-12-10T08:27:59.836+0100,Patria textilis compello. Ciminatio deprecator videlicet.
"{'rate': 3, 'label': 'THREE'}","[{'id': None, 'metadata': {'title': 'FAME IS THE SPUR', 'pages': 'unknown'}}]","[{'id': 0, 'title': 'end'}, {'id': 0, 'title': 'IT HAPPENED ONE NIGHT'}]",2021-12-15T21:17:18.519+0100,2021-12-06T14:33:33.108+0100,Modi vulnus enim. Delicate vorax minima.
"{'rate': 2, 'label': 'TWO'}","[{'id': None, 'metadata': {'title': 'INFINITE JEST', 'pages': 'unknown'}}]","[{'id': 0, 'title': 'end'}, {'id': 0, 'title': 'THE MALTESE FALCON'}]",2021-12-18T02:19:59.932+0100,2021-12-17T16:25:16.437+0100,Vapulus colo terga. Adhuc aedificium temporibus.
"{'rate': 1, 'label': 'ONE'}","[{'id': None, 'metadata': {'title': 'A TIME OF GIFTS', 'pages': 'unknown'}}]","[{'id': 0, 'title': 'end'}, {'id': 0, 'title': 'METROPOLIS'}]",2021-12-22T07:22:13.797+0100,2021-12-25T04:54:09.340+0100,Aestus vis verus. Contra perferendis vox.
"{'rate': 4, 'label': 'FOUR'}","[{'id': None, 'metadata': {'title': 'BEYOND THE MEXIQUE BAY', 'pages': 'unknown'}}]","[{'id': 0, 'title': 'MEMENTO'}, {'id': 0, 'title': 'end'}]",2021-12-18T20:40:05.913+0100,2021-12-20T07:52:09.691+0100,Delicate ciminatio vere. Torqueo confido subiungo.
"{'rate': 5, 'label': 'FIVE'}","[{'id': None, 'metadata': {'title': 'FAME IS THE SPUR', 'pages': 'unknown'}}]","[{'id': 0, 'title': 'end'}, {'id': 0, 'title': 'THE USUAL SUSPECTS'}]",2021-12-07T15:40:49.857+0100,2021-12-23T21:56:33.235+0100,Aeger facere ara. Subseco vulgaris aduro.
"{'rate': 3, 'label': 'THREE'}","[{'id': None, 'metadata': {'title': 'THE YELLOW MEADS OF ASPHODEL', 'pages': 'unknown'}}]","[{'id': 0, 'title': 'FULL METAL JACKET'}, {'id': 0, 'title': 'end'}]",2021-12-23T20:32:18.649+0100,2021-12-07T23:56:30.871+0100,Colloco sunt et. Tyrannus depromo tenax.
"{'rate': 4, 'label': 'FOUR'}","[{'id': None, 'metadata': {'title': 'THE WAY OF ALL FLESH', 'pages': 'unknown'}}]","[{'id': 0, 'title': 'end'}, {'id': 0, 'title': 'BEAUTY AND THE BEAST'}]",2021-12-12T20:53:54.146+0100,2021-12-24T02:13:23.274+0100,Bestia cimentarius vel. Admitto cras versus.
"{'rate': 3, 'label': 'THREE'}","[{'id': None, 'metadata': {'title': 'CONSIDER THE LILIES', 'pages': 'unknown'}}]","[{'id': 0, 'title': 'end'}, {'id': 0, 'title': 'OLDEUBOI'}]",2021-12-10T06:35:39.407+0100,2021-12-03T04:11:03.172+0100,Cornu corpus terebro. Adulescens certo adsuesco.
"{'rate': 1, 'label': 'ONE'}","[{'id': None, 'metadata': {'title': ""IT'S A BATTLEFIELD"", 'pages': 'unknown'}}]","[{'id': 0, 'title': 'end'}, {'id': 0, 'title': 'PSYCHO'}]",2021-12-19T14:19:38.466+0100,2021-12-24T07:16:39.541+0100,Cupio assumenda vox. Vos abscido arcesso.
"{'rate': 1, 'label': 'ONE'}","[{'id': None, 'metadata': {'title': 'THE GLORY AND THE DREAM', 'pages': 'unknown'}}]","[{'id': 0, 'title': 'end'}, {'id': 0, 'title': 'THE LORD OF THE RINGS: THE FELLOWSHIP OF THE RING'}]",2021-12-27T15:38:27.103+0100,2021-12-15T03:02:10.980+0100,Velit creator in. Accedo vergo sint.
"{'rate': 2, 'label': 'TWO'}","[{'id': None, 'metadata': {'title': 'THE GOLDEN APPLES OF THE SUN', 'pages': 'unknown'}}]","[{'id': 0, 'title': 'end'}, {'id': 0, 'title': 'THE ELEPHANT MAN'}]",2021-12-29T21:28:00.181+0100,2021-12-28T03:47:38.557+0100,Pecco iste quidem. Atavus paens solitudo.
"{'rate': 1, 'label': 'ONE'}","[{'id': None, 'metadata': {'title': 'BUTTER IN A LORDLY DISH', 'pages': 'unknown'}}]","[{'id': 0, 'title': 'THE LORD OF THE RINGS: THE TWO TOWERS'}, {'id': 0, 'title': 'end'}]",2021-12-24T06:24:03.438+0100,2021-12-05T23:28:15.854+0100,Vergo velociter bardus. Facere subvenio sophismata.
"{'rate': 2, 'label': 'TWO'}","[{'id': None, 'metadata': {'title': 'I SING THE BODY ELECTRIC', 'pages': 'unknown'}}]","[{'id': 0, 'title': 'end'}, {'id': 0, 'title': 'GOODFELLAS'}]",2021-12-02T02:02:08.706+0100,2021-12-28T23:31:47.880+0100,Laudantium bellum concido. Cuius tollo alii.
"{'rate': 5, 'label': 'FIVE'}","[{'id': None, 'metadata': {'title': 'CLOUDS OF WITNESS', 'pages': 'unknown'}}]","[{'id': 0, 'title': 'IN THE NAME OF THE FATHER'}, {'id': 0, 'title': 'end'}]",2021-12-11T22:47:20.809+0100,2021-12-27T14:17:29.985+0100,Delibero iure venio. Comprehendo saepe animi.
"{'rate': 4, 'label': 'FOUR'}","[{'id': None, 'metadata': {'title': 'THE WASTE LAND', 'pages': 'unknown'}}]","[{'id': 0, 'title': 'NUOVO CINEMA PARADISO'}, {'id': 0, 'title': 'end'}]",2021-12-11T04:00:34.432+0100,2021-12-27T13:14:37.761+0100,Considero supplanto pecunia. Benigne alias temporibus.
"{'rate': 3, 'label': 'THREE'}","[{'id': None, 'metadata': {'title': 'THINGS FALL APART', 'pages': 'unknown'}}]","[{'id': 0, 'title': 'end'}, {'id': 0, 'title': 'GONE GIRL'}]",2021-12-01T02:10:41.586+0100,2021-12-25T01:45:53.431+0100,Pecunia allatus volup. Aperio aufero venia.
"{'rate': 1, 'label': 'ONE'}","[{'id': None, 'metadata': {'title': 'THE MOVING FINGER', 'pages': 'unknown'}}]","[{'id': 0, 'title': 'THE DEPARTED'}, {'id': 0, 'title': 'end'}]",2021-12-10T15:22:39.099+0100,2021-12-26T17:28:27.004+0100,Omnis suus earum. Derelinquo cenaculum versus.
"{'rate': 1, 'label': 'ONE'}","[{'id': None, 'metadata': {'title': 'BLITHE SPIRIT', 'pages': 'unknown'}}]","[{'id': 0, 'title': 'end'}, {'id': 0, 'title': 'THE DEPARTED'}]",2021-12-09T21:41:35.218+0100,2021-12-28T21:09:38.123+0100,Viriliter acer eum. Cedo amoveo thalassinus.
"{'rate': 3, 'label': 'THREE'}","[{'id': None, 'metadata': {'title': 'GONE WITH THE WIND', 'pages': 'unknown'}}]","[{'id': 0, 'title': 'end'}, {'id': 0, 'title': 'V FOR VENDETTA'}]",2021-12-25T17:19:58.973+0100,2021-12-20T14:36:08.210+0100,Thesaurus clibanus vester. Tamdiu adultus quo.
"{'rate': 4, 'label': 'FOUR'}","[{'id': None, 'metadata': {'title': 'ENDLESS NIGHT', 'pages': 'unknown'}}]","[{'id': 0, 'title': 'TOY STORY 2'}, {'id': 0, 'title': 'end'}]",2021-12-01T04:09:01.069+0100,2021-12-21T10:27:58.013+0100,Vetus deorsum terra. Canto crux torqueo.
"{'rate': 3, 'label': 'THREE'}","[{'id': None, 'metadata': {'title': 'AN EVIL CRADLING', 'pages': 'unknown'}}]","[{'id': 0, 'title': 'end'}, {'id': 0, 'title': 'THE ELEPHANT MAN'}]",2021-12-11T20:31:59.412+0100,2021-12-04T15:56:32.511+0100,Solus alter vesco. Corrupti summa tenuis.
"{'rate': 3, 'label': 'THREE'}","[{'id': None, 'metadata': {'title': 'THE GOLDEN APPLES OF THE SUN', 'pages': 'unknown'}}]","[{'id': 0, 'title': 'end'}, {'id': 0, 'title': 'THE BIG LEBOWSKI'}]",2021-12-26T13:36:41.557+0100,2021-12-22T05:02:04.798+0100,Vae caecus conforto. Creber creo theatrum.
"{'rate': 2, 'label': 'TWO'}","[{'id': None, 'metadata': {'title': 'FAME IS THE SPUR', 'pages': 'unknown'}}]","[{'id': 0, 'title': 'LIFE IS BEAUTIFUL'}, {'id': 0, 'title': 'end'}]",2021-12-02T14:21:18.373+0100,2021-12-28T19:22:47.063+0100,Casso ademptio placeat. Comes nihil tenuis.
"{'rate': 1, 'label': 'ONE'}","[{'id': None, 'metadata': {'title': 'BUTTER IN A LORDLY DISH', 'pages': 'unknown'}}]","[{'id': 0, 'title': 'end'}, {'id': 0, 'title': 'THE APARTMENT'}]",2021-12-02T02:33:00.328+0100,2021-12-30T22:21:10.102+0100,Verumtamen adinventitias velociter. Cultellus unde autem.
"{'rate': 5, 'label': 'FIVE'}","[{'id': None, 'metadata': {'title': 'NUMBER THE STARS', 'pages': 'unknown'}}]","[{'id': 0, 'title': 'end'}, {'id': 0, 'title': 'CITY LIGHTS'}]",2021-12-18T18:18:09.221+0100,2021-12-03T17:19:21.447+0100,Adulatio suggero advoco. Compello suscipit arcus.
"{'rate': 4, 'label': 'FOUR'}","[{'id': None, 'metadata': {'title': 'FOR WHOM THE BELL TOLLS', 'pages': 'unknown'}}]","[{'id': 0, 'title': 'DONNIE DARKO'}, {'id': 0, 'title': 'end'}]",2021-12-08T05:31:31.467+0100,2021-12-25T04:36:00.460+0100,Curatio advenio subvenio. Aetas adduco apostolus.
"{'rate': 5, 'label': 'FIVE'}","[{'id': None, 'metadata': {'title': 'NO HIGHWAY', 'pages': 'unknown'}}]","[{'id': 0, 'title': 'end'}, {'id': 0, 'title': 'JUDGMENT AT NUREMBERG'}]",2021-12-03T01:59:37.032+0100,2021-12-16T00:56:28.074+0100,Comedo deficio reprehenderit. Ancilla cogo cedo.
"{'rate': 4, 'label': 'FOUR'}","[{'id': None, 'metadata': {'title': 'THE MAN WITHIN', 'pages': 'unknown'}}]","[{'id': 0, 'title': 'end'}, {'id': 0, 'title': 'THE BEST YEARS OF OUR LIVES'}]",2021-12-26T07:45:24.732+0100,2021-12-25T23:12:01.246+0100,Accendo tempus cedo. Suscipit ventito ullus.
"{'rate': 5, 'label': 'FIVE'}","[{'id': None, 'metadata': {'title': 'THE LAST ENEMY', 'pages': 'unknown'}}]","[{'id': 0, 'title': 'THE STING'}, {'id': 0, 'title': 'end'}]",2021-12-16T02:18:47.863+0100,2021-12-18T07:01:06.775+0100,Voluptas conventus velum. Tardus vorax id.
"{'rate': 5, 'label': 'FIVE'}","[{'id': None, 'metadata': {'title': 'FOR WHOM THE BELL TOLLS', 'pages': 'unknown'}}]","[{'id': 0, 'title': 'end'}, {'id': 0, 'title': 'THE USUAL SUSPECTS'}]",2021-12-02T05:36:08.460+0100,2021-12-20T12:39:20.401+0100,Cattus cresco tam. Denique claustrum arbitro.
"{'rate': 2, 'label': 'TWO'}","[{'id': None, 'metadata': {'title': 'FOR A BREATH I TARRY', 'pages': 'unknown'}}]","[{'id': 0, 'title': 'TOY STORY 3'}, {'id': 0, 'title': 'end'}]",2021-12-16T14:33:47.655+0100,2021-12-10T06:03:33.159+0100,Curtus vinitor coerceo. Arceo corrigo armarium.
"{'rate': 4, 'label': 'FOUR'}","[{'id': None, 'metadata': {'title': 'WAITING FOR THE BARBARIANS', 'pages': 'unknown'}}]","[{'id': 0, 'title': 'SHOLAY'}, {'id': 0, 'title': 'end'}]",2021-12-05T09:15:27.825+0100,2021-12-26T15:25:25.482+0100,Ut curo recusandae. Arceo vae nobis.
"{'rate': 3, 'label': 'THREE'}","[{'id': None, 'metadata': {'title': 'NO LONGER AT EASE', 'pages': 'unknown'}}]","[{'id': 0, 'title': 'PSYCHO'}, {'id': 0, 'title': 'end'}]",2021-12-22T21:40:12.936+0100,2021-12-14T02:29:47.877+0100,Quod certe coruscus. Texo tricesimus verumtamen.
"{'rate': 2, 'label': 'TWO'}","[{'id': None, 'metadata': {'title': 'THE MOVING FINGER', 'pages': 'unknown'}}]","[{'id': 0, 'title': 'STAR WARS: EPISODE IX – THE RISE OF SKYWALKER'}, {'id': 0, 'title': 'end'}]",2021-12-05T13:41:13.488+0100,2021-12-27T03:35:14.823+0100,Supellex aureus usitas. Iusto torqueo truculenter.
"{'rate': 2, 'label': 'TWO'}","[{'id': None, 'metadata': {'title': 'THE CURIOUS INCIDENT OF THE DOG IN THE NIGHT-TIME', 'pages': 'unknown'}}]","[{'id': 0, 'title': 'UNFORGIVEN'}, {'id': 0, 'title': 'end'}]",2021-12-22T18:00:21.818+0100,2021-12-17T18:49:37.978+0100,Summopere aspernatur talus. Vos cernuus infit.
"{'rate': 5, 'label': 'FIVE'}","[{'id': None, 'metadata': {'title': 'EVERYTHING IS ILLUMINATED', 'pages': 'unknown'}}]","[{'id': 0, 'title': 'end'}, {'id': 0, 'title': 'THE KID'}]",2021-12-01T08:40:36.957+0100,2021-12-30T20:36:01.116+0100,Atrox cupressus verus. Tametsi crepusculum videlicet.
"{'rate': 1, 'label': 'ONE'}","[{'id': None, 'metadata': {'title': 'BLITHE SPIRIT', 'pages': 'unknown'}}]","[{'id': 0, 'title': '3 IDIOTS'}, {'id': 0, 'title': 'end'}]",2021-12-06T02:57:16.251+0100,2021-12-29T01:29:02.003+0100,Et adulescens quo. Valde corroboro arguo.
"{'rate': 4, 'label': 'FOUR'}","[{'id': None, 'metadata': {'title': 'IN DEATH GROUND', 'pages': 'unknown'}}]","[{'id': 0, 'title': 'end'}, {'id': 0, 'title': 'THE MATRIX'}]",2021-12-19T00:56:48.651+0100,2021-12-05T03:37:02.376+0100,Aggero cilicium cetera. At dens bellum.
"{'rate': 2, 'label': 'TWO'}","[{'id': None, 'metadata': {'title': 'WHERE ANGELS FEAR TO TREAD', 'pages': 'unknown'}}]","[{'id': 0, 'title': 'PULP FICTION'}, {'id': 0, 'title': 'end'}]",2021-12-16T16:31:24.377+0100,2021-12-24T15:16:37.303+0100,Tyrannus adamo vehemens. Ut assumenda spiculum.
"{'rate': 2, 'label': 'TWO'}","[{'id': None, 'metadata': {'title': 'MOTHER NIGHT', 'pages': 'unknown'}}]","[{'id': 0, 'title': 'PRINCESS MONONOKE'}, {'id': 0, 'title': 'end'}]",2021-12-27T14:06:25.058+0100,2021-12-07T19:09:08.382+0100,Atrox ademptio spes. Suppellex coniecto facilis.
"{'rate': 4, 'label': 'FOUR'}","[{'id': None, 'metadata': {'title': 'NUMBER THE STARS', 'pages': 'unknown'}}]","[{'id': 0, 'title': 'ROCKY'}, {'id': 0, 'title': 'end'}]",2021-12-19T23:40:55.775+0100,2021-12-25T16:40:42.111+0100,Sordeo considero mollitia. Credo curriculum sit.
"{'rate': 2, 'label': 'TWO'}","[{'id': None, 'metadata': {'title': 'THE CURIOUS INCIDENT OF THE DOG IN THE NIGHT-TIME', 'pages': 'unknown'}}]","[{'id': 0, 'title': 'THE WIZARD OF OZ'}, {'id': 0, 'title': 'end'}]",2021-12-07T22:53:39.807+0100,2021-12-07T19:33:15.054+0100,Omnis vivo articulus. Ara territo textus.
