rating,books,movies,updated,created,text
"{'rate': 2, 'label': 'TWO'}","[{'id': None, 'metadata': {'title': 'THOSE BARREN LEAVES, THRONES, DOMINATIONS', 'pages': 'unknown'}}]","[{'id': 0, 'title': 'end'}, {'id': 0, 'title': 'TOY STORY 3'}]",2021-12-27T23:41:21.857+0100,2021-12-18T07:58:07.640+0100,Eos virga acsi. Quibusdam traho universe.
"{'rate': 4, 'label': 'FOUR'}","[{'id': None, 'metadata': {'title': ""THE MIRROR CRACK'D FROM SIDE TO SIDE"", 'pages': 'unknown'}}]","[{'id': 0, 'title': 'end'}, {'id': 0, 'title': 'PULP FICTION'}]",2021-12-28T20:16:40.326+0100,2021-12-01T15:21:04.389+0100,Carpo tener autus. Vulnero antepono utpote.
"{'rate': 3, 'label': 'THREE'}","[{'id': None, 'metadata': {'title': 'TO A GOD UNKNOWN', 'pages': 'unknown'}}]","[{'id': 0, 'title': 'HOTEL RWANDA'}, {'id': 0, 'title': 'end'}]",2021-12-08T00:00:25.923+0100,2021-12-10T07:20:26.663+0100,Odit repudiandae adultus. Placeat defungo et.
"{'rate': 1, 'label': 'ONE'}","[{'id': None, 'metadata': {'title': 'THE SKULL BENEATH THE SKIN', 'pages': 'unknown'}}]","[{'id': 0, 'title': 'DOG DAY AFTERNOON'}, {'id': 0, 'title': 'end'}]",2021-12-28T16:52:41.889+0100,2021-12-06T20:50:25.261+0100,Virtus cupiditate cimentarius. Anser deporto cubicularis.
"{'rate': 4, 'label': 'FOUR'}","[{'id': None, 'metadata': {'title': ""IT'S A BATTLEFIELD"", 'pages': 'unknown'}}]","[{'id': 0, 'title': 'end'}, {'id': 0, 'title': 'THE LORD OF THE RINGS: THE FELLOWSHIP OF THE RING'}]",2021-12-27T20:17:23.904+0100,2021-12-14T00:51:47.690+0100,Basium arguo debilito. Tumultus vinitor cedo.
"{'rate': 1, 'label': 'ONE'}","[{'id': None, 'metadata': {'title': 'SHALL NOT PERISH', 'pages': 'unknown'}}]","[{'id': 0, 'title': 'GONE GIRL'}, {'id': 0, 'title': 'end'}]",2021-12-21T07:40:30.629+0100,2021-12-27T08:02:46.215+0100,Perspiciatis utilis architecto. Usque taedium ipsum.
"{'rate': 1, 'label': 'ONE'}","[{'id': None, 'metadata': {'title': 'NOLI ME TANGERE', 'pages': 'unknown'}}]","[{'id': 0, 'title': 'end'}, {'id': 0, 'title': 'PARIS, TEXAS'}]",2021-12-15T12:42:19.084+0100,2021-12-12T11:52:58.181+0100,Mollitia cupio deripio. Tricesimus tripudio carcer.
"{'rate': 2, 'label': 'TWO'}","[{'id': None, 'metadata': {'title': 'THE GOLDEN BOWL', 'pages': 'unknown'}}]","[{'id': 0, 'title': 'end'}, {'id': 0, 'title': 'GRAN TORINO'}]",2021-12-26T12:19:16.454+0100,2021-12-27T23:11:36.392+0100,Tutamen vesper assumenda. Auris tum comes.
"{'rate': 5, 'label': 'FIVE'}","[{'id': None, 'metadata': {'title': 'POSTERN OF FATE', 'pages': 'unknown'}}]","[{'id': 0, 'title': 'DEAD POETS SOCIETY'}, {'id': 0, 'title': 'end'}]",2021-12-15T11:25:50.710+0100,2021-12-14T08:35:24.110+0100,Casus cunae vere. Sollers cura adduco.
"{'rate': 3, 'label': 'THREE'}","[{'id': None, 'metadata': {'title': 'THE PROPER STUDY', 'pages': 'unknown'}}]","[{'id': 0, 'title': '12 YEARS A SLAVE'}, {'id': 0, 'title': 'end'}]",2021-12-05T20:40:50.808+0100,2021-12-14T19:02:04.625+0100,Vobis pauci vulpes. Trucido una bellicus.
"{'rate': 2, 'label': 'TWO'}","[{'id': None, 'metadata': {'title': 'THE WAY THROUGH THE WOODS', 'pages': 'unknown'}}]","[{'id': 0, 'title': 'PAPER MOON'}, {'id': 0, 'title': 'end'}]",2021-12-23T08:11:20.462+0100,2021-12-06T07:34:15.456+0100,Depraedor suspendo ut. Claustrum adinventitias aestas.
"{'rate': 3, 'label': 'THREE'}","[{'id': None, 'metadata': {'title': 'THE WASTE LAND', 'pages': 'unknown'}}]","[{'id': 0, 'title': 'end'}, {'id': 0, 'title': 'PLATOON'}]",2021-12-09T04:19:40.151+0100,2021-12-22T22:08:28.633+0100,Conatus adulatio ascisco. Concido occaecati coadunatio.
"{'rate': 1, 'label': 'ONE'}","[{'id': None, 'metadata': {'title': 'SHALL NOT PERISH', 'pages': 'unknown'}}]","[{'id': 0, 'title': 'end'}, {'id': 0, 'title': 'MODERN TIMES'}]",2021-12-13T16:20:52.110+0100,2021-12-20T11:39:06.799+0100,Vita eligendi comprehendo. Illum vacuus adeptio.
"{'rate': 5, 'label': 'FIVE'}","[{'id': None, 'metadata': {'title': 'IN DEATH GROUND', 'pages': 'unknown'}}]","[{'id': 0, 'title': 'ONCE UPON A TIME IN THE WEST'}, {'id': 0, 'title': 'end'}]",2021-12-14T14:57:00.476+0100,2021-12-19T05:37:33.714+0100,Administratio omnis cursus. Agnitio minus sufficio.
"{'rate': 1, 'label': 'ONE'}","[{'id': None, 'metadata': {'title': 'COVER HER FACE', 'pages': 'unknown'}}]","[{'id': 0, 'title': 'end'}, {'id': 0, 'title': 'STAR WARS: EPISODE III – REVENGE OF THE SITH'}]",2021-12-02T17:34:53.221+0100,2021-12-16T02:05:41.103+0100,Crustulum tego acidus. Capillus crustulum totus.
"{'rate': 1, 'label': 'ONE'}","[{'id': None, 'metadata': {'title': 'SURPRISED BY JOY', 'pages': 'unknown'}}]","[{'id': 0, 'title': 'end'}, {'id': 0, 'title': 'INTO THE WILD'}]",2021-12-18T13:20:07.253+0100,2021-12-18T22:26:40.881+0100,Adfero peior utor. Anser aestas arbitro.
"{'rate': 1, 'label': 'ONE'}","[{'id': None, 'metadata': {'title': 'POSTERN OF FATE', 'pages': 'unknown'}}]","[{'id': 0, 'title': 'end'}, {'id': 0, 'title': 'LOCK, STOCK AND TWO SMOKING BARRELS'}]",2021-12-25T17:07:25.726+0100,2021-12-06T16:13:42.528+0100,Admitto beneficium ventosus. Uterque vestrum ascisco.
"{'rate': 5, 'label': 'FIVE'}","[{'id': None, 'metadata': {'title': 'BURY MY HEART AT WOUNDED KNEE', 'pages': 'unknown'}}]","[{'id': 0, 'title': 'end'}, {'id': 0, 'title': 'JAWS'}]",2021-12-30T22:19:55.042+0100,2021-12-19T07:56:56.432+0100,Odit cultellus iusto. Bos arbustum quo.
"{'rate': 4, 'label': 'FOUR'}","[{'id': None, 'metadata': {'title': 'TIGER! TIGER!', 'pages': 'unknown'}}]","[{'id': 0, 'title': 'L.A. CONFIDENTIAL'}, {'id': 0, 'title': 'end'}]",2021-12-08T18:31:28.167+0100,2021-12-23T10:25:04.484+0100,Versus arx arto. Aduro coniecto asporto.
"{'rate': 4, 'label': 'FOUR'}","[{'id': None, 'metadata': {'title': ""THE MIRROR CRACK'D FROM SIDE TO SIDE"", 'pages': 'unknown'}}]","[{'id': 0, 'title': 'THERE WILL BE BLOOD'}, {'id': 0, 'title': 'end'}]",2021-12-18T16:03:41.386+0100,2021-12-05T21:26:14.267+0100,Ad aeneus abeo. Nisi barba constans.
"{'rate': 1, 'label': 'ONE'}","[{'id': None, 'metadata': {'title': 'LILIES OF THE FIELD', 'pages': 'unknown'}}]","[{'id': 0, 'title': 'A CLOCKWORK ORANGE'}, {'id': 0, 'title': 'end'}]",2021-12-16T00:24:39.769+0100,2021-12-04T08:36:11.003+0100,Debitis pax tergo. Vinculum iste denique.
"{'rate': 4, 'label': 'FOUR'}","[{'id': None, 'metadata': {'title': 'MOAB IS MY WASHPOT', 'pages': 'unknown'}}]","[{'id': 0, 'title': 'HEAT'}, {'id': 0, 'title': 'end'}]",2021-12-08T20:59:45.067+0100,2021-12-19T12:55:47.733+0100,Vir tergiversatio audio. Eos inflammatio xiphias.
"{'rate': 2, 'label': 'TWO'}","[{'id': None, 'metadata': {'title': 'SHALL NOT PERISH', 'pages': 'unknown'}}]","[{'id': 0, 'title': 'end'}, {'id': 0, 'title': 'THE SHAWSHANK REDEMPTION'}]",2021-12-25T18:21:42.631+0100,2021-12-05T21:14:26.363+0100,Unde blanditiis conservo. Titulus ara cultellus.
"{'rate': 3, 'label': 'THREE'}","[{'id': None, 'metadata': {'title': 'THE PAINTED VEIL', 'pages': 'unknown'}}]","[{'id': 0, 'title': 'end'}, {'id': 0, 'title': 'TERMINATOR 2: JUDGMENT DAY'}]",2021-12-23T06:57:00.695+0100,2021-12-08T06:17:33.275+0100,Ut molestiae vilis. Tero possimus clarus.
"{'rate': 4, 'label': 'FOUR'}","[{'id': None, 'metadata': {'title': 'THE TORMENT OF OTHERS', 'pages': 'unknown'}}]","[{'id': 0, 'title': 'PERSONA'}, {'id': 0, 'title': 'end'}]",2021-12-02T12:29:39.152+0100,2021-12-17T09:02:24.827+0100,Confugo vita desipio. Arbor suppono tutis.
"{'rate': 2, 'label': 'TWO'}","[{'id': None, 'metadata': {'title': 'NUMBER THE STARS', 'pages': 'unknown'}}]","[{'id': 0, 'title': 'end'}, {'id': 0, 'title': 'THE DARK KNIGHT RISES'}]",2021-12-27T00:10:14.591+0100,2021-12-28T07:24:34.751+0100,Crinis caelum aer. Sumo crepusculum nisi.
"{'rate': 5, 'label': 'FIVE'}","[{'id': None, 'metadata': {'title': 'FOR WHOM THE BELL TOLLS', 'pages': 'unknown'}}]","[{'id': 0, 'title': 'end'}, {'id': 0, 'title': 'ETERNAL SUNSHINE OF THE SPOTLESS MIND'}]",2021-12-26T07:00:57.917+0100,2021-12-05T10:55:12.226+0100,Canis delego porro. Stultus catena denique.
"{'rate': 3, 'label': 'THREE'}","[{'id': None, 'metadata': {'title': 'TO SAY NOTHING OF THE DOG', 'pages': 'unknown'}}]","[{'id': 0, 'title': 'GOOD WILL HUNTING'}, {'id': 0, 'title': 'end'}]",2021-12-02T22:56:46.003+0100,2021-12-27T22:57:44.921+0100,Ea terreo reprehenderit. Cum timor tribuo.
"{'rate': 4, 'label': 'FOUR'}","[{'id': None, 'metadata': {'title': 'NOLI ME TANGERE', 'pages': 'unknown'}}]","[{'id': 0, 'title': 'end'}, {'id': 0, 'title': 'THE LORD OF THE RINGS: THE RETURN OF THE KING'}]",2021-12-22T21:22:43.413+0100,2021-12-13T16:43:23.838+0100,Aestivus quo corporis. Vel statim tempore.
"{'rate': 1, 'label': 'ONE'}","[{'id': None, 'metadata': {'title': 'ENDLESS NIGHT', 'pages': 'unknown'}}]","[{'id': 0, 'title': 'TOUCH OF EVIL'}, {'id': 0, 'title': 'end'}]",2021-12-03T17:12:03.431+0100,2021-12-25T02:50:59.995+0100,Solus attollo vacuus. Attero aut tam.
"{'rate': 3, 'label': 'THREE'}","[{'id': None, 'metadata': {'title': 'THE WEALTH OF NATIONS', 'pages': 'unknown'}}]","[{'id': 0, 'title': 'end'}, {'id': 0, 'title': 'HOW TO TRAIN YOUR DRAGON'}]",2021-12-19T19:42:48.857+0100,2021-12-22T08:13:30.586+0100,Blanditiis constans vulgo. Arma conturbo adopto.
"{'rate': 4, 'label': 'FOUR'}","[{'id': None, 'metadata': {'title': 'LILIES OF THE FIELD', 'pages': 'unknown'}}]","[{'id': 0, 'title': 'FULL METAL JACKET'}, {'id': 0, 'title': 'end'}]",2021-12-28T23:26:21.732+0100,2021-12-03T18:09:42.293+0100,Capitulus ciminatio subvenio. Viduata peccatus adfero.
"{'rate': 2, 'label': 'TWO'}","[{'id': None, 'metadata': {'title': 'MOTHER NIGHT', 'pages': 'unknown'}}]","[{'id': 0, 'title': 'TOY STORY 3'}, {'id': 0, 'title': 'end'}]",2021-12-04T03:10:45.630+0100,2021-12-25T06:45:17.910+0100,Ultra decumbo umquam. Cura cogo nemo.
"{'rate': 2, 'label': 'TWO'}","[{'id': None, 'metadata': {'title': 'THE LITTLE FOXES', 'pages': 'unknown'}}]","[{'id': 0, 'title': 'THE BIG LEBOWSKI'}, {'id': 0, 'title': 'end'}]",2021-12-12T21:04:11.616+0100,2021-12-25T11:21:55.970+0100,Vilicus decerno turba. At velum curo.
"{'rate': 1, 'label': 'ONE'}","[{'id': None, 'metadata': {'title': 'MR STANDFAST', 'pages': 'unknown'}}]","[{'id': 0, 'title': 'end'}, {'id': 0, 'title': 'RAGING BULL'}]",2021-12-13T16:15:05.256+0100,2021-12-04T15:26:09.087+0100,Civitas sit adstringo. Ascit acies tracto.
"{'rate': 2, 'label': 'TWO'}","[{'id': None, 'metadata': {'title': 'FOR WHOM THE BELL TOLLS', 'pages': 'unknown'}}]","[{'id': 0, 'title': 'LOCK, STOCK AND TWO SMOKING BARRELS'}, {'id': 0, 'title': 'end'}]",2021-12-23T13:51:58.854+0100,2021-12-25T09:30:54.537+0100,Defessus abstergo theologus. Clementia sodalitas astrum.
"{'rate': 1, 'label': 'ONE'}","[{'id': None, 'metadata': {'title': 'FROM HERE TO ETERNITY', 'pages': 'unknown'}}]","[{'id': 0, 'title': 'LIFE IS BEAUTIFUL'}, {'id': 0, 'title': 'end'}]",2021-12-14T13:59:01.240+0100,2021-12-21T23:53:40.159+0100,Bestia balbus et. Unus stella compono.
"{'rate': 5, 'label': 'FIVE'}","[{'id': None, 'metadata': {'title': 'FROM HERE TO ETERNITY', 'pages': 'unknown'}}]","[{'id': 0, 'title': 'TERMINATOR 2: JUDGMENT DAY'}, {'id': 0, 'title': 'end'}]",2021-12-01T03:42:14.744+0100,2021-12-19T20:41:56.786+0100,Tandem cognatus antiquus. Voveo tabesco ut.
"{'rate': 4, 'label': 'FOUR'}","[{'id': None, 'metadata': {'title': 'ALONE ON A WIDE, WIDE SEA', 'pages': 'unknown'}}]","[{'id': 0, 'title': 'end'}, {'id': 0, 'title': 'ALL ABOUT EVE'}]",2021-12-01T20:16:14.689+0100,2021-12-19T00:55:48.656+0100,Perspiciatis tenus non. Torqueo textor ter.
"{'rate': 2, 'label': 'TWO'}","[{'id': None, 'metadata': {'title': 'NUMBER THE STARS', 'pages': 'unknown'}}]","[{'id': 0, 'title': 'end'}, {'id': 0, 'title': 'THE SILENCE OF THE LAMBS'}]",2021-12-11T11:21:25.612+0100,2021-12-22T05:25:11.770+0100,Theca virtus deficio. Aeger ut cauda.
"{'rate': 2, 'label': 'TWO'}","[{'id': None, 'metadata': {'title': 'THE WASTE LAND', 'pages': 'unknown'}}]","[{'id': 0, 'title': 'SAVING PRIVATE RYAN'}, {'id': 0, 'title': 'end'}]",2021-12-19T08:23:32.264+0100,2021-12-02T02:12:24.627+0100,Victus caries patrocinor. Ducimus verto socius.
"{'rate': 4, 'label': 'FOUR'}","[{'id': None, 'metadata': {'title': 'THE SKULL BENEATH THE SKIN', 'pages': 'unknown'}}]","[{'id': 0, 'title': 'ONCE UPON A TIME IN AMERICA'}, {'id': 0, 'title': 'end'}]",2021-12-10T10:35:41.202+0100,2021-12-21T09:11:41.704+0100,Libero animi bellum. Doloribus curtus dolores.
"{'rate': 4, 'label': 'FOUR'}","[{'id': None, 'metadata': {'title': 'THE MOVING FINGER', 'pages': 'unknown'}}]","[{'id': 0, 'title': 'end'}, {'id': 0, 'title': 'BRAVEHEART'}]",2021-12-03T11:13:06.545+0100,2021-12-28T02:29:59.954+0100,Villa cum tabesco. Tergiversatio absens auxilium.
"{'rate': 4, 'label': 'FOUR'}","[{'id': None, 'metadata': {'title': ""THE MONKEY'S RAINCOAT"", 'pages': 'unknown'}}]","[{'id': 0, 'title': 'STAR WARS: EPISODE IX – THE RISE OF SKYWALKER'}, {'id': 0, 'title': 'end'}]",2021-12-22T05:37:18.367+0100,2021-12-12T19:37:39.617+0100,Non sulum admoneo. Et altus comburo.
"{'rate': 3, 'label': 'THREE'}","[{'id': None, 'metadata': {'title': 'BEYOND THE MEXIQUE BAY', 'pages': 'unknown'}}]","[{'id': 0, 'title': 'end'}, {'id': 0, 'title': 'TO KILL A MOCKINGBIRD'}]",2021-12-21T16:22:00.632+0100,2021-12-04T11:23:24.640+0100,Autem ascisco synagoga. Coniecto delinquo solitudo.
"{'rate': 2, 'label': 'TWO'}","[{'id': None, 'metadata': {'title': 'TO YOUR SCATTERED BODIES GO', 'pages': 'unknown'}}]","[{'id': 0, 'title': 'THE BIG LEBOWSKI'}, {'id': 0, 'title': 'end'}]",2021-12-09T06:06:35.583+0100,2021-12-11T19:03:40.515+0100,Dignissimos carcer thermae. Venia vespillo cilicium.
"{'rate': 5, 'label': 'FIVE'}","[{'id': None, 'metadata': {'title': 'IF I FORGET THEE JERUSALEM', 'pages': 'unknown'}}]","[{'id': 0, 'title': 'A WEDNESDAY'}, {'id': 0, 'title': 'end'}]",2021-12-14T00:08:02.302+0100,2021-12-04T06:19:08.660+0100,Sopor bestia molestiae. Tergo delectus cibo.
"{'rate': 2, 'label': 'TWO'}","[{'id': None, 'metadata': {'title': 'BUTTER IN A LORDLY DISH', 'pages': 'unknown'}}]","[{'id': 0, 'title': 'end'}, {'id': 0, 'title': 'BICYCLE THIEVES'}]",2021-12-29T00:41:23.095+0100,2021-12-06T03:04:52.975+0100,Conitor possimus vis. Suasoria aspernatur celebrer.
"{'rate': 3, 'label': 'THREE'}","[{'id': None, 'metadata': {'title': 'IN A DRY SEASON', 'pages': 'unknown'}}]","[{'id': 0, 'title': 'end'}, {'id': 0, 'title': 'MEMENTO'}]",2021-12-19T08:13:11.784+0100,2021-12-13T13:03:55.563+0100,Varius ipsum aspicio. Ademptio charisma magnam.
"{'rate': 4, 'label': 'FOUR'}","[{'id': None, 'metadata': {'title': 'FAME IS THE SPUR', 'pages': 'unknown'}}]","[{'id': 0, 'title': 'end'}, {'id': 0, 'title': 'ALL ABOUT EVE'}]",2021-12-02T01:23:31.394+0100,2021-12-28T15:46:36.087+0100,Approbo bardus cattus. Aestivus vilicus sequi.
"{'rate': 2, 'label': 'TWO'}","[{'id': None, 'metadata': {'title': 'OF HUMAN BONDAGE', 'pages': 'unknown'}}]","[{'id': 0, 'title': 'HACKSAW RIDGE'}, {'id': 0, 'title': 'end'}]",2021-12-28T19:38:05.022+0100,2021-12-16T11:13:16.668+0100,Amoveo aptus arcesso. Soluta vester id.
"{'rate': 3, 'label': 'THREE'}","[{'id': None, 'metadata': {'title': 'THE OTHER SIDE OF SILENCE', 'pages': 'unknown'}}]","[{'id': 0, 'title': 'THE TREASURE OF THE SIERRA MADRE'}, {'id': 0, 'title': 'end'}]",2021-12-11T20:45:30.119+0100,2021-12-03T04:42:50.009+0100,Casus despecto claudeo. Utpote vorago socius.
"{'rate': 1, 'label': 'ONE'}","[{'id': None, 'metadata': {'title': 'A PASSAGE TO INDIA', 'pages': 'unknown'}}]","[{'id': 0, 'title': 'end'}, {'id': 0, 'title': 'LIFE OF BRIAN'}]",2021-12-26T15:28:21.351+0100,2021-12-21T01:12:39.655+0100,Ut tenetur deleniti. Sub possimus curis.
"{'rate': 2, 'label': 'TWO'}","[{'id': None, 'metadata': {'title': 'O JERUSALEM!', 'pages': 'unknown'}}]","[{'id': 0, 'title': 'BACK TO THE FUTURE'}, {'id': 0, 'title': 'end'}]",2021-12-22T00:11:26.109+0100,2021-12-06T10:05:03.756+0100,Cur blanditiis infit. Vulgaris optio termes.
"{'rate': 5, 'label': 'FIVE'}","[{'id': None, 'metadata': {'title': 'NO HIGHWAY', 'pages': 'unknown'}}]","[{'id': 0, 'title': 'end'}, {'id': 0, 'title': 'UNFORGIVEN'}]",2021-12-18T05:35:09.196+0100,2021-12-02T01:16:42.907+0100,Delego venio casus. Natus vergo aeneus.
"{'rate': 3, 'label': 'THREE'}","[{'id': None, 'metadata': {'title': 'A CONFEDERACY OF DUNCES', 'pages': 'unknown'}}]","[{'id': 0, 'title': 'PSYCHO'}, {'id': 0, 'title': 'end'}]",2021-12-11T06:17:40.319+0100,2021-12-21T19:20:21.837+0100,Occaecati aro absorbeo. Aliquam illum cervus.
"{'rate': 3, 'label': 'THREE'}","[{'id': None, 'metadata': {'title': 'NOW SLEEPS THE CRIMSON PETAL', 'pages': 'unknown'}}]","[{'id': 0, 'title': 'end'}, {'id': 0, 'title': 'THE PRESTIGE'}]",2021-12-29T00:39:45.151+0100,2021-12-01T07:49:59.002+0100,Qui adfectus aperio. Brevis tantum curia.
"{'rate': 4, 'label': 'FOUR'}","[{'id': None, 'metadata': {'title': 'THE WORLD, THE FLESH AND THE DEVIL', 'pages': 'unknown'}}]","[{'id': 0, 'title': 'CINEMA PARADISO'}, {'id': 0, 'title': 'end'}]",2021-12-11T10:38:41.910+0100,2021-12-02T00:58:39.983+0100,Animadverto urbanus surculus. Curvo tenuis aliquid.
"{'rate': 1, 'label': 'ONE'}","[{'id': None, 'metadata': {'title': 'WHEN THE GREEN WOODS LAUGH', 'pages': 'unknown'}}]","[{'id': 0, 'title': 'end'}, {'id': 0, 'title': 'STAND BY ME'}]",2021-12-11T00:58:04.745+0100,2021-12-08T08:22:23.368+0100,Quos cui dolores. Vester iste arx.
"{'rate': 1, 'label': 'ONE'}","[{'id': None, 'metadata': {'title': 'TO YOUR SCATTERED BODIES GO', 'pages': 'unknown'}}]","[{'id': 0, 'title': 'ALL ABOUT EVE'}, {'id': 0, 'title': 'end'}]",2021-12-02T05:04:38.634+0100,2021-12-13T08:28:47.210+0100,Tui blanditiis uter. Capto tibi virgo.
"{'rate': 5, 'label': 'FIVE'}","[{'id': None, 'metadata': {'title': 'THE WEALTH OF NATIONS', 'pages': 'unknown'}}]","[{'id': 0, 'title': 'BEFORE SUNRISE'}, {'id': 0, 'title': 'end'}]",2021-12-06T16:57:08.564+0100,2021-12-29T20:38:04.421+0100,Vulgaris adinventitias ascisco. Aqua cur pauper.
"{'rate': 1, 'label': 'ONE'}","[{'id': None, 'metadata': {'title': 'ALONE ON A WIDE, WIDE SEA', 'pages': 'unknown'}}]","[{'id': 0, 'title': 'LIFE OF BRIAN'}, {'id': 0, 'title': 'end'}]",2021-12-11T06:42:48.387+0100,2021-12-23T07:33:09.717+0100,Volaticus quia consectetur. Conscendo beatae celer.
"{'rate': 1, 'label': 'ONE'}","[{'id': None, 'metadata': {'title': 'FOR A BREATH I TARRY', 'pages': 'unknown'}}]","[{'id': 0, 'title': 'THE DEER HUNTER'}, {'id': 0, 'title': 'end'}]",2021-12-05T16:12:42.625+0100,2021-12-11T15:55:18.459+0100,Aut ante terreo. Abduco denuo corporis.
"{'rate': 5, 'label': 'FIVE'}","[{'id': None, 'metadata': {'title': 'A TIME OF GIFTS', 'pages': 'unknown'}}]","[{'id': 0, 'title': 'PAPER MOON'}, {'id': 0, 'title': 'end'}]",2021-12-25T16:33:54.464+0100,2021-12-06T18:11:51.880+0100,Absorbeo communis denego. Tenuis torqueo deleniti.
"{'rate': 3, 'label': 'THREE'}","[{'id': None, 'metadata': {'title': 'PRECIOUS BANE', 'pages': 'unknown'}}]","[{'id': 0, 'title': 'end'}, {'id': 0, 'title': 'BACK TO THE FUTURE'}]",2021-12-28T06:16:23.302+0100,2021-12-16T06:50:56.854+0100,A enim timidus. Studio terminatio timidus.
"{'rate': 3, 'label': 'THREE'}","[{'id': None, 'metadata': {'title': 'FAME IS THE SPUR', 'pages': 'unknown'}}]","[{'id': 0, 'title': 'TOY STORY 3'}, {'id': 0, 'title': 'end'}]",2021-12-21T20:59:36.241+0100,2021-12-13T13:31:14.615+0100,Inventore curto caelestis. Defigo textor ulterius.
"{'rate': 2, 'label': 'TWO'}","[{'id': None, 'metadata': {'title': 'THIS LIME TREE BOWER', 'pages': 'unknown'}}]","[{'id': 0, 'title': 'THE BIG LEBOWSKI'}, {'id': 0, 'title': 'end'}]",2021-12-05T08:18:09.493+0100,2021-12-30T01:19:19.779+0100,Ocer quia sunt. Consequuntur compello uxor.
"{'rate': 1, 'label': 'ONE'}","[{'id': None, 'metadata': {'title': 'THE MOVING TOYSHOP', 'pages': 'unknown'}}]","[{'id': 0, 'title': 'end'}, {'id': 0, 'title': 'CHINATOWN'}]",2021-12-04T20:37:07.241+0100,2021-12-09T17:26:30.076+0100,Id aut tristis. Celer comprehendo demum.
"{'rate': 2, 'label': 'TWO'}","[{'id': None, 'metadata': {'title': 'IN A DRY SEASON', 'pages': 'unknown'}}]","[{'id': 0, 'title': 'end'}, {'id': 0, 'title': 'THE PIANIST'}]",2021-12-05T04:54:28.865+0100,2021-12-28T18:52:28.533+0100,Conscendo itaque ad. Cur quis statim.
"{'rate': 5, 'label': 'FIVE'}","[{'id': None, 'metadata': {'title': 'NUMBER THE STARS', 'pages': 'unknown'}}]","[{'id': 0, 'title': 'DOG DAY AFTERNOON'}, {'id': 0, 'title': 'end'}]",2021-12-09T00:07:04.258+0100,2021-12-21T19:41:48.392+0100,Cado ut despecto. Audio ventus cresco.
"{'rate': 1, 'label': 'ONE'}","[{'id': None, 'metadata': {'title': 'CLOUDS OF WITNESS', 'pages': 'unknown'}}]","[{'id': 0, 'title': 'end'}, {'id': 0, 'title': 'INTO THE WILD'}]",2021-12-28T03:09:37.579+0100,2021-12-23T19:20:36.693+0100,Advenio cavus audax. Defungo clarus vesica.
"{'rate': 3, 'label': 'THREE'}","[{'id': None, 'metadata': {'title': 'TO A GOD UNKNOWN', 'pages': 'unknown'}}]","[{'id': 0, 'title': 'end'}, {'id': 0, 'title': 'MARY AND MAX'}]",2021-12-24T07:27:22.515+0100,2021-12-08T03:12:02.308+0100,Tubineus demitto provident. Distinctio somniculosus conforto.
"{'rate': 1, 'label': 'ONE'}","[{'id': None, 'metadata': {'title': 'FAME IS THE SPUR', 'pages': 'unknown'}}]","[{'id': 0, 'title': 'THE LORD OF THE RINGS: THE RETURN OF THE KING'}, {'id': 0, 'title': 'end'}]",2021-12-29T23:15:30.205+0100,2021-12-25T14:30:06.121+0100,Terreo asper ancilla. Tenuis cum itaque.
"{'rate': 2, 'label': 'TWO'}","[{'id': None, 'metadata': {'title': 'A CONFEDERACY OF DUNCES', 'pages': 'unknown'}}]","[{'id': 0, 'title': 'AMERICAN BEAUTY'}, {'id': 0, 'title': 'end'}]",2021-12-18T16:29:23.931+0100,2021-12-10T04:45:45.497+0100,Cervus ut virga. Anser vis tersus.
"{'rate': 5, 'label': 'FIVE'}","[{'id': None, 'metadata': {'title': 'IF I FORGET THEE JERUSALEM', 'pages': 'unknown'}}]","[{'id': 0, 'title': 'end'}, {'id': 0, 'title': 'TOY STORY 3'}]",2021-12-20T19:36:09.628+0100,2021-12-08T00:05:01.853+0100,Trucido appello aegrus. Ratione admoveo tyrannus.
"{'rate': 5, 'label': 'FIVE'}","[{'id': None, 'metadata': {'title': 'WAITING FOR THE BARBARIANS', 'pages': 'unknown'}}]","[{'id': 0, 'title': 'end'}, {'id': 0, 'title': 'BICYCLE THIEVES'}]",2021-12-04T03:56:30.903+0100,2021-12-05T20:27:30.623+0100,Iste ter et. Et amoveo decretum.
"{'rate': 4, 'label': 'FOUR'}","[{'id': None, 'metadata': {'title': 'LOOK TO WINDWARD', 'pages': 'unknown'}}]","[{'id': 0, 'title': 'end'}, {'id': 0, 'title': 'DOUBLE INDEMNITY'}]",2021-12-28T15:10:04.116+0100,2021-12-17T16:44:09.743+0100,Tamisium deficio modi. Rerum vitiosus despirmatio.
"{'rate': 3, 'label': 'THREE'}","[{'id': None, 'metadata': {'title': 'POSTERN OF FATE', 'pages': 'unknown'}}]","[{'id': 0, 'title': 'end'}, {'id': 0, 'title': 'LIFE IS BEAUTIFUL'}]",2021-12-23T10:12:55.936+0100,2021-12-11T02:00:50.388+0100,Non colligo quaerat. Contego valens tollo.
"{'rate': 1, 'label': 'ONE'}","[{'id': None, 'metadata': {'title': 'FOR A BREATH I TARRY', 'pages': 'unknown'}}]","[{'id': 0, 'title': 'end'}, {'id': 0, 'title': 'FULL METAL JACKET'}]",2021-12-21T02:28:06.753+0100,2021-12-11T09:43:52.940+0100,Barba fugiat admoneo. Adopto toties labore.
"{'rate': 4, 'label': 'FOUR'}","[{'id': None, 'metadata': {'title': 'FOR A BREATH I TARRY', 'pages': 'unknown'}}]","[{'id': 0, 'title': 'THE GODFATHER'}, {'id': 0, 'title': 'end'}]",2021-12-02T13:06:43.066+0100,2021-12-16T20:41:26.212+0100,Cito viduo adhaero. Crepusculum abstergo aliquid.
"{'rate': 1, 'label': 'ONE'}","[{'id': None, 'metadata': {'title': 'THE PAINTED VEIL', 'pages': 'unknown'}}]","[{'id': 0, 'title': 'THE GRAND BUDAPEST HOTEL'}, {'id': 0, 'title': 'end'}]",2021-12-24T01:07:11.854+0100,2021-12-20T16:11:34.163+0100,Valeo texo admitto. Est amitto corrumpo.
"{'rate': 3, 'label': 'THREE'}","[{'id': None, 'metadata': {'title': 'CLOUDS OF WITNESS', 'pages': 'unknown'}}]","[{'id': 0, 'title': 'INCEPTION'}, {'id': 0, 'title': 'end'}]",2021-12-26T23:19:01.659+0100,2021-12-21T00:35:55.966+0100,Coadunatio neque delego. Coruscus non sollicito.
"{'rate': 5, 'label': 'FIVE'}","[{'id': None, 'metadata': {'title': 'TO YOUR SCATTERED BODIES GO', 'pages': 'unknown'}}]","[{'id': 0, 'title': '2001: A SPACE ODYSSEY'}, {'id': 0, 'title': 'end'}]",2021-12-15T20:00:30.496+0100,2021-12-12T16:43:00.717+0100,Appositus pel calamitas. Casus aedificium temeritas.
"{'rate': 3, 'label': 'THREE'}","[{'id': None, 'metadata': {'title': 'HAVE HIS CARCASE', 'pages': 'unknown'}}]","[{'id': 0, 'title': 'end'}, {'id': 0, 'title': 'MAD MAX: FURY ROAD'}]",2021-12-04T22:43:35.114+0100,2021-12-19T08:01:35.356+0100,Veritatis vitium ipsam. Numquam volva color.
"{'rate': 5, 'label': 'FIVE'}","[{'id': None, 'metadata': {'title': 'THE LITTLE FOXES', 'pages': 'unknown'}}]","[{'id': 0, 'title': 'end'}, {'id': 0, 'title': 'JURASSIC PARK'}]",2021-12-03T07:14:05.477+0100,2021-12-16T17:35:23.727+0100,Ut aeger bellicus. Cavus defero armarium.
"{'rate': 2, 'label': 'TWO'}","[{'id': None, 'metadata': {'title': 'VANITY FAIR', 'pages': 'unknown'}}]","[{'id': 0, 'title': 'ROOM'}, {'id': 0, 'title': 'end'}]",2021-12-21T15:39:30.945+0100,2021-12-05T05:30:42.538+0100,Vesper caute ad. Comis comminor conservo.
"{'rate': 5, 'label': 'FIVE'}","[{'id': None, 'metadata': {'title': 'NO LONGER AT EASE', 'pages': 'unknown'}}]","[{'id': 0, 'title': 'end'}, {'id': 0, 'title': '12 YEARS A SLAVE'}]",2021-12-07T08:15:52.439+0100,2021-12-07T08:39:33.905+0100,Cotidie alo comminor. Ambitus brevis certe.
"{'rate': 2, 'label': 'TWO'}","[{'id': None, 'metadata': {'title': 'TO YOUR SCATTERED BODIES GO', 'pages': 'unknown'}}]","[{'id': 0, 'title': 'APOCALYPSE NOW'}, {'id': 0, 'title': 'end'}]",2021-12-08T19:05:26.213+0100,2021-12-09T09:52:23.243+0100,Sponte illo aut. Claro id unde.
"{'rate': 3, 'label': 'THREE'}","[{'id': None, 'metadata': {'title': 'MANY WATERS', 'pages': 'unknown'}}]","[{'id': 0, 'title': 'end'}, {'id': 0, 'title': 'GROUNDHOG DAY'}]",2021-12-14T05:08:41.200+0100,2021-12-19T16:35:04.197+0100,Aranea clam tum. Tepesco consequuntur denique.
