rating,books,movies,updated,created,text
"{'rate': 4, 'label': 'FOUR'}","[{'id': None, 'metadata': {'title': 'LET US NOW PRAISE FAMOUS MEN', 'pages': 'unknown'}}]","[{'id': 0, 'title': 'end'}, {'id': 0, 'title': 'ROCKY'}]",2021-12-29T02:25:45.575+0100,2021-12-05T01:41:10.955+0100,Cupio decimus usitas. Aggero necessitatibus volup.
"{'rate': 3, 'label': 'THREE'}","[{'id': None, 'metadata': {'title': 'BLITHE SPIRIT', 'pages': 'unknown'}}]","[{'id': 0, 'title': 'PARIS, TEXAS'}, {'id': 0, 'title': 'end'}]",2021-12-02T00:14:45.815+0100,2021-12-15T07:50:59.104+0100,Valeo succedo quam. Canto viduo corrigo.
"{'rate': 2, 'label': 'TWO'}","[{'id': None, 'metadata': {'title': 'THOSE BARREN LEAVES, THRONES, DOMINATIONS', 'pages': 'unknown'}}]","[{'id': 0, 'title': 'end'}, {'id': 0, 'title': 'HOW TO TRAIN YOUR DRAGON'}]",2021-12-14T04:39:12.219+0100,2021-12-21T02:53:10.183+0100,Venustas velut iusto. Consequuntur depraedor voluptatem.
"{'rate': 4, 'label': 'FOUR'}","[{'id': None, 'metadata': {'title': 'THE PAINTED VEIL', 'pages': 'unknown'}}]","[{'id': 0, 'title': 'ETERNAL SUNSHINE OF THE SPOTLESS MIND'}, {'id': 0, 'title': 'end'}]",2021-12-19T10:22:11.179+0100,2021-12-20T14:59:40.031+0100,Triumphus reiciendis varietas. Crux atavus solitudo.
"{'rate': 1, 'label': 'ONE'}","[{'id': None, 'metadata': {'title': 'WHERE ANGELS FEAR TO TREAD', 'pages': 'unknown'}}]","[{'id': 0, 'title': 'end'}, {'id': 0, 'title': 'THE SIXTH SENSE'}]",2021-12-05T03:56:49.383+0100,2021-12-22T02:54:14.452+0100,Bardus cito aegre. Decimus supplanto armo.
"{'rate': 2, 'label': 'TWO'}","[{'id': None, 'metadata': {'title': 'CONSIDER THE LILIES', 'pages': 'unknown'}}]","[{'id': 0, 'title': 'end'}, {'id': 0, 'title': 'STAR WARS: EPISODE II – ATTACK OF THE CLONES'}]",2021-12-12T13:31:51.663+0100,2021-12-10T20:52:10.169+0100,Creber vel tracto. Vel ventosus angelus.
"{'rate': 4, 'label': 'FOUR'}","[{'id': None, 'metadata': {'title': 'THE LITTLE FOXES', 'pages': 'unknown'}}]","[{'id': 0, 'title': 'LOCK, STOCK AND TWO SMOKING BARRELS'}, {'id': 0, 'title': 'end'}]",2021-12-03T04:18:51.616+0100,2021-12-24T22:00:28.327+0100,Tempore est odit. Totam occaecati vulnero.
"{'rate': 3, 'label': 'THREE'}","[{'id': None, 'metadata': {'title': 'THE WAY THROUGH THE WOODS', 'pages': 'unknown'}}]","[{'id': 0, 'title': 'end'}, {'id': 0, 'title': 'CIDADE DE DEUS'}]",2021-12-29T04:42:44.129+0100,2021-12-18T11:09:34.507+0100,Deorsum venia corrumpo. Amissio spero degero.
"{'rate': 2, 'label': 'TWO'}","[{'id': None, 'metadata': {'title': 'FOR A BREATH I TARRY', 'pages': 'unknown'}}]","[{'id': 0, 'title': 'end'}, {'id': 0, 'title': 'WITNESS FOR THE PROSECUTION'}]",2021-12-23T15:48:36.256+0100,2021-12-16T14:40:19.216+0100,Auditor arbor magni. Texo aestus odit.
"{'rate': 5, 'label': 'FIVE'}","[{'id': None, 'metadata': {'title': 'THE GOLDEN APPLES OF THE SUN', 'pages': 'unknown'}}]","[{'id': 0, 'title': 'DONNIE DARKO'}, {'id': 0, 'title': 'end'}]",2021-12-06T19:02:46.378+0100,2021-12-27T15:26:53.187+0100,Contra spiritus admoveo. Dicta clam vulnus.
"{'rate': 4, 'label': 'FOUR'}","[{'id': None, 'metadata': {'title': 'NO LONGER AT EASE', 'pages': 'unknown'}}]","[{'id': 0, 'title': 'end'}, {'id': 0, 'title': 'MAD MAX: FURY ROAD'}]",2021-12-09T08:56:56.030+0100,2021-12-11T14:40:27.848+0100,In vulnero caveo. Bis et sumptus.
"{'rate': 5, 'label': 'FIVE'}","[{'id': None, 'metadata': {'title': 'STRANGER IN A STRANGE LAND', 'pages': 'unknown'}}]","[{'id': 0, 'title': 'end'}, {'id': 0, 'title': 'THE USUAL SUSPECTS'}]",2021-12-22T18:43:56.271+0100,2021-12-05T12:34:09.677+0100,Spectaculum demoror decens. Vicinus adipiscor considero.
"{'rate': 3, 'label': 'THREE'}","[{'id': None, 'metadata': {'title': 'O JERUSALEM!', 'pages': 'unknown'}}]","[{'id': 0, 'title': 'BACK TO THE FUTURE'}, {'id': 0, 'title': 'end'}]",2021-12-13T11:42:15.847+0100,2021-12-13T20:41:00.617+0100,Versus tergeo aureus. Possimus vulgo contego.
"{'rate': 4, 'label': 'FOUR'}","[{'id': None, 'metadata': {'title': 'THE MOVING FINGER', 'pages': 'unknown'}}]","[{'id': 0, 'title': 'end'}, {'id': 0, 'title': 'THE TERMINATOR'}]",2021-12-25T05:00:34.614+0100,2021-12-22T14:49:59.704+0100,Allatus stella tamquam. Usque despecto itaque.
"{'rate': 3, 'label': 'THREE'}","[{'id': None, 'metadata': {'title': 'EYELESS IN GAZA', 'pages': 'unknown'}}]","[{'id': 0, 'title': 'end'}, {'id': 0, 'title': 'DOUBLE INDEMNITY'}]",2021-12-19T11:05:24.275+0100,2021-12-03T22:18:27.228+0100,Apto aetas victoria. Contabesco modi teneo.
"{'rate': 5, 'label': 'FIVE'}","[{'id': None, 'metadata': {'title': 'THOSE BARREN LEAVES, THRONES, DOMINATIONS', 'pages': 'unknown'}}]","[{'id': 0, 'title': 'SUNRISE: A SONG OF TWO HUMANS'}, {'id': 0, 'title': 'end'}]",2021-12-22T07:33:19.625+0100,2021-12-07T21:41:56.882+0100,Totus vehemens vinco. Ustulo sint veritas.
"{'rate': 3, 'label': 'THREE'}","[{'id': None, 'metadata': {'title': 'FROM HERE TO ETERNITY', 'pages': 'unknown'}}]","[{'id': 0, 'title': 'end'}, {'id': 0, 'title': 'CITY OF GOD'}]",2021-12-20T11:59:12.753+0100,2021-12-25T10:24:24.013+0100,Currus quibusdam certe. Ut ait coaegresco.
"{'rate': 5, 'label': 'FIVE'}","[{'id': None, 'metadata': {'title': 'MOAB IS MY WASHPOT', 'pages': 'unknown'}}]","[{'id': 0, 'title': 'end'}, {'id': 0, 'title': 'STAR WARS: EPISODE V - THE EMPIRE STRIKES BACK'}]",2021-12-05T16:50:38.440+0100,2021-12-01T03:30:00.529+0100,Vero reiciendis sit. Vitium canonicus communis.
"{'rate': 1, 'label': 'ONE'}","[{'id': None, 'metadata': {'title': 'BURY MY HEART AT WOUNDED KNEE', 'pages': 'unknown'}}]","[{'id': 0, 'title': 'end'}, {'id': 0, 'title': 'THE BOURNE ULTIMATUM'}]",2021-12-01T15:24:40.058+0100,2021-12-11T04:21:59.215+0100,Decumbo terga summisse. Corrumpo talis viduata.
"{'rate': 2, 'label': 'TWO'}","[{'id': None, 'metadata': {'title': ""THE MIRROR CRACK'D FROM SIDE TO SIDE"", 'pages': 'unknown'}}]","[{'id': 0, 'title': 'PARIS, TEXAS'}, {'id': 0, 'title': 'end'}]",2021-12-03T09:52:27.654+0100,2021-12-05T02:58:36.784+0100,Sit vomica vulariter. Annus testimonium bonus.
"{'rate': 5, 'label': 'FIVE'}","[{'id': None, 'metadata': {'title': 'THE CURIOUS INCIDENT OF THE DOG IN THE NIGHT-TIME', 'pages': 'unknown'}}]","[{'id': 0, 'title': 'STALKER'}, {'id': 0, 'title': 'end'}]",2021-12-05T00:57:22.207+0100,2021-12-29T13:01:56.423+0100,Cribro tenuis in. Thalassinus caute caste.
"{'rate': 2, 'label': 'TWO'}","[{'id': None, 'metadata': {'title': 'THE LITTLE FOXES', 'pages': 'unknown'}}]","[{'id': 0, 'title': 'JUDGMENT AT NUREMBERG'}, {'id': 0, 'title': 'end'}]",2021-12-10T07:57:45.690+0100,2021-12-09T01:26:36.267+0100,Quia temporibus corrumpo. Accusamus excepturi odio.
"{'rate': 1, 'label': 'ONE'}","[{'id': None, 'metadata': {'title': 'BUTTER IN A LORDLY DISH', 'pages': 'unknown'}}]","[{'id': 0, 'title': 'THE GODFATHER: PART II'}, {'id': 0, 'title': 'end'}]",2021-12-07T23:02:03.177+0100,2021-12-21T18:31:28.018+0100,Adeptio demens aut. Tristis cilicium ascit.
"{'rate': 2, 'label': 'TWO'}","[{'id': None, 'metadata': {'title': 'HAVE HIS CARCASE', 'pages': 'unknown'}}]","[{'id': 0, 'title': 'end'}, {'id': 0, 'title': 'INTOUCHABLES'}]",2021-12-26T23:34:43.585+0100,2021-12-28T12:28:10.330+0100,Dolor ait decerno. Caveo verto auxilium.
"{'rate': 5, 'label': 'FIVE'}","[{'id': None, 'metadata': {'title': 'LILIES OF THE FIELD', 'pages': 'unknown'}}]","[{'id': 0, 'title': 'end'}, {'id': 0, 'title': 'THE DARK KNIGHT'}]",2021-12-29T05:16:14.903+0100,2021-12-13T09:51:43.369+0100,Vestrum certo ipsa. Depraedor molestiae corrigo.
"{'rate': 2, 'label': 'TWO'}","[{'id': None, 'metadata': {'title': 'EVERYTHING IS ILLUMINATED', 'pages': 'unknown'}}]","[{'id': 0, 'title': 'end'}, {'id': 0, 'title': 'THERE WILL BE BLOOD'}]",2021-12-22T02:18:17.250+0100,2021-12-18T10:25:56.429+0100,Articulus somniculosus vesper. Verus cribro sortitus.
"{'rate': 5, 'label': 'FIVE'}","[{'id': None, 'metadata': {'title': 'COVER HER FACE', 'pages': 'unknown'}}]","[{'id': 0, 'title': 'end'}, {'id': 0, 'title': 'THE DEPARTED'}]",2021-12-22T10:02:39.229+0100,2021-12-30T02:53:53.032+0100,Trado sit admitto. Sub voluptatibus denego.
"{'rate': 3, 'label': 'THREE'}","[{'id': None, 'metadata': {'title': 'AS I LAY DYING', 'pages': 'unknown'}}]","[{'id': 0, 'title': 'MEMENTO'}, {'id': 0, 'title': 'end'}]",2021-12-06T07:18:08.334+0100,2021-12-28T08:49:19.628+0100,Delicate aut utpote. Vorax denuo tertius.
"{'rate': 2, 'label': 'TWO'}","[{'id': None, 'metadata': {'title': 'THE CURIOUS INCIDENT OF THE DOG IN THE NIGHT-TIME', 'pages': 'unknown'}}]","[{'id': 0, 'title': 'end'}, {'id': 0, 'title': 'SPOTLIGHT'}]",2021-12-22T21:56:54.802+0100,2021-12-08T08:35:59.757+0100,Adulescens vulgus deripio. Sint cicuta contego.
"{'rate': 4, 'label': 'FOUR'}","[{'id': None, 'metadata': {'title': 'BUTTER IN A LORDLY DISH', 'pages': 'unknown'}}]","[{'id': 0, 'title': 'end'}, {'id': 0, 'title': 'MONSTERS, INC.'}]",2021-12-01T13:07:55.004+0100,2021-12-19T16:04:02.346+0100,Arbustum dolores virgo. Placeat turbo advoco.
"{'rate': 2, 'label': 'TWO'}","[{'id': None, 'metadata': {'title': 'MOTHER NIGHT', 'pages': 'unknown'}}]","[{'id': 0, 'title': 'end'}, {'id': 0, 'title': 'SOME LIKE IT HOT'}]",2021-12-01T14:18:23.163+0100,2021-12-03T18:29:51.665+0100,Vulticulus suspendo adaugeo. Nobis decerno peccatus.
"{'rate': 3, 'label': 'THREE'}","[{'id': None, 'metadata': {'title': 'OH! TO BE IN ENGLAND', 'pages': 'unknown'}}]","[{'id': 0, 'title': 'end'}, {'id': 0, 'title': 'MONTY PYTHON AND THE HOLY GRAIL'}]",2021-12-19T08:18:53.948+0100,2021-12-29T16:39:33.973+0100,Tergeo veniam sophismata. Concedo aggero vinum.
"{'rate': 3, 'label': 'THREE'}","[{'id': None, 'metadata': {'title': 'THE PARLIAMENT OF MAN', 'pages': 'unknown'}}]","[{'id': 0, 'title': 'THE GREAT DICTATOR'}, {'id': 0, 'title': 'end'}]",2021-12-26T21:16:38.659+0100,2021-12-29T20:26:31.781+0100,Careo apud abstergo. Doloremque solium claustrum.
"{'rate': 1, 'label': 'ONE'}","[{'id': None, 'metadata': {'title': 'THE WAY OF ALL FLESH', 'pages': 'unknown'}}]","[{'id': 0, 'title': 'end'}, {'id': 0, 'title': 'PLATOON'}]",2021-12-25T08:50:03.166+0100,2021-12-22T02:13:13.538+0100,Utrum at civis. Claudeo denique quia.
"{'rate': 5, 'label': 'FIVE'}","[{'id': None, 'metadata': {'title': 'THE WASTE LAND', 'pages': 'unknown'}}]","[{'id': 0, 'title': 'WITNESS FOR THE PROSECUTION'}, {'id': 0, 'title': 'end'}]",2021-12-03T09:22:57.905+0100,2021-12-13T04:25:03.602+0100,Texo alter xiphias. Aequitas quos chirographum.
"{'rate': 5, 'label': 'FIVE'}","[{'id': None, 'metadata': {'title': ""IT'S A BATTLEFIELD"", 'pages': 'unknown'}}]","[{'id': 0, 'title': 'ALL ABOUT EVE'}, {'id': 0, 'title': 'end'}]",2021-12-27T02:58:01.046+0100,2021-12-10T12:05:34.426+0100,Quaerat denego conspergo. Assentator despecto succedo.
"{'rate': 2, 'label': 'TWO'}","[{'id': None, 'metadata': {'title': 'THE TORMENT OF OTHERS', 'pages': 'unknown'}}]","[{'id': 0, 'title': 'STAR WARS: EPISODE VII - THE FORCE AWAKENS'}, {'id': 0, 'title': 'end'}]",2021-12-23T14:50:17.492+0100,2021-12-21T12:14:21.023+0100,Absorbeo capillus tonsor. Sustineo tamisium virtus.
"{'rate': 3, 'label': 'THREE'}","[{'id': None, 'metadata': {'title': 'CLOUDS OF WITNESS', 'pages': 'unknown'}}]","[{'id': 0, 'title': 'end'}, {'id': 0, 'title': 'NETWORK'}]",2021-12-23T15:30:37.225+0100,2021-12-06T19:13:28.717+0100,Solitudo totus esse. Cotidie tyrannus impedit.
"{'rate': 5, 'label': 'FIVE'}","[{'id': None, 'metadata': {'title': 'NO LONGER AT EASE', 'pages': 'unknown'}}]","[{'id': 0, 'title': 'ROOM'}, {'id': 0, 'title': 'end'}]",2021-12-11T00:52:52.083+0100,2021-12-16T14:58:37.810+0100,Ante est illum. Confido benevolentia defungo.
"{'rate': 4, 'label': 'FOUR'}","[{'id': None, 'metadata': {'title': 'CLOUDS OF WITNESS', 'pages': 'unknown'}}]","[{'id': 0, 'title': 'TAXI DRIVER'}, {'id': 0, 'title': 'end'}]",2021-12-01T14:02:09.959+0100,2021-12-02T03:55:50.545+0100,Porro desidero cubicularis. Depopulo aufero eveniet.
"{'rate': 4, 'label': 'FOUR'}","[{'id': None, 'metadata': {'title': 'CARRION COMFORT', 'pages': 'unknown'}}]","[{'id': 0, 'title': 'end'}, {'id': 0, 'title': 'TWELVE MONKEYS'}]",2021-12-22T04:33:07.575+0100,2021-12-04T04:53:48.248+0100,Suffoco bos delibero. Thermae viriliter viridis.
"{'rate': 4, 'label': 'FOUR'}","[{'id': None, 'metadata': {'title': 'TIGER! TIGER!', 'pages': 'unknown'}}]","[{'id': 0, 'title': 'PULP FICTION'}, {'id': 0, 'title': 'end'}]",2021-12-01T04:40:08.753+0100,2021-12-13T00:37:18.811+0100,Thalassinus somniculosus approbo. Avoco quis apostolus.
"{'rate': 4, 'label': 'FOUR'}","[{'id': None, 'metadata': {'title': 'THAT GOOD NIGHT', 'pages': 'unknown'}}]","[{'id': 0, 'title': 'end'}, {'id': 0, 'title': 'THE GRAND BUDAPEST HOTEL'}]",2021-12-27T05:43:44.751+0100,2021-12-02T07:13:05.022+0100,Articulus tollo pax. Uxor amita urbanus.
"{'rate': 3, 'label': 'THREE'}","[{'id': None, 'metadata': {'title': 'NUMBER THE STARS', 'pages': 'unknown'}}]","[{'id': 0, 'title': 'end'}, {'id': 0, 'title': 'CIDADE DE DEUS'}]",2021-12-23T19:20:57.517+0100,2021-12-23T09:07:53.325+0100,Comis quasi contego. Calco veniam sortitus.
"{'rate': 1, 'label': 'ONE'}","[{'id': None, 'metadata': {'title': 'TIGER! TIGER!', 'pages': 'unknown'}}]","[{'id': 0, 'title': 'THE BEST YEARS OF OUR LIVES'}, {'id': 0, 'title': 'end'}]",2021-12-14T12:52:46.296+0100,2021-12-01T15:47:58.828+0100,Cenaculum cornu optio. Caritas tabgo tumultus.
"{'rate': 1, 'label': 'ONE'}","[{'id': None, 'metadata': {'title': 'THE LAST ENEMY', 'pages': 'unknown'}}]","[{'id': 0, 'title': '12 YEARS A SLAVE'}, {'id': 0, 'title': 'end'}]",2021-12-28T23:12:50.908+0100,2021-12-18T23:03:12.786+0100,Strues culpa pax. Paulatim degenero nemo.
"{'rate': 5, 'label': 'FIVE'}","[{'id': None, 'metadata': {'title': 'THE OTHER SIDE OF SILENCE', 'pages': 'unknown'}}]","[{'id': 0, 'title': 'FINDING NEMO'}, {'id': 0, 'title': 'end'}]",2021-12-13T04:50:36.759+0100,2021-12-19T07:03:49.979+0100,Victus pauper capitulus. Allatus quasi vulnero.
"{'rate': 2, 'label': 'TWO'}","[{'id': None, 'metadata': {'title': 'COVER HER FACE', 'pages': 'unknown'}}]","[{'id': 0, 'title': 'STAR WARS: EPISODE IV – A NEW HOPE'}, {'id': 0, 'title': 'end'}]",2021-12-03T07:31:08.917+0100,2021-12-12T19:02:43.261+0100,Teres creator accusantium. Dolorem triginta sint.
"{'rate': 1, 'label': 'ONE'}","[{'id': None, 'metadata': {'title': 'THE WAY OF ALL FLESH', 'pages': 'unknown'}}]","[{'id': 0, 'title': 'end'}, {'id': 0, 'title': 'WITNESS FOR THE PROSECUTION'}]",2021-12-07T23:34:05.705+0100,2021-12-20T10:11:42.469+0100,Doloribus possimus officiis. Tergo adipisci corpus.
"{'rate': 2, 'label': 'TWO'}","[{'id': None, 'metadata': {'title': 'VANITY FAIR', 'pages': 'unknown'}}]","[{'id': 0, 'title': 'end'}, {'id': 0, 'title': 'THE GRAPES OF WRATH'}]",2021-12-13T01:28:31.909+0100,2021-12-09T03:18:11.459+0100,Stillicidium vinitor aspicio. Amissio ultra cunabula.
"{'rate': 5, 'label': 'FIVE'}","[{'id': None, 'metadata': {'title': ""THE MIRROR CRACK'D FROM SIDE TO SIDE"", 'pages': 'unknown'}}]","[{'id': 0, 'title': 'end'}, {'id': 0, 'title': 'TOUCH OF EVIL'}]",2021-12-08T14:48:44.430+0100,2021-12-09T13:23:34.593+0100,Laboriosam vesica verumtamen. Hic ars aer.
"{'rate': 2, 'label': 'TWO'}","[{'id': None, 'metadata': {'title': 'FROM HERE TO ETERNITY', 'pages': 'unknown'}}]","[{'id': 0, 'title': 'THE LORD OF THE RINGS: THE RETURN OF THE KING'}, {'id': 0, 'title': 'end'}]",2021-12-27T13:45:21.004+0100,2021-12-29T01:13:39.455+0100,Acquiro celer solvo. Adaugeo ut demens.
"{'rate': 2, 'label': 'TWO'}","[{'id': None, 'metadata': {'title': ""THE SOLDIER'S ART"", 'pages': 'unknown'}}]","[{'id': 0, 'title': 'end'}, {'id': 0, 'title': 'WITNESS FOR THE PROSECUTION'}]",2021-12-09T08:22:34.919+0100,2021-12-29T23:15:47.889+0100,Omnis rerum nemo. Tantum torqueo eum.
"{'rate': 4, 'label': 'FOUR'}","[{'id': None, 'metadata': {'title': 'THE SUN ALSO RISES', 'pages': 'unknown'}}]","[{'id': 0, 'title': 'end'}, {'id': 0, 'title': 'WALL·E'}]",2021-12-06T08:10:07.639+0100,2021-12-11T04:15:10.695+0100,Tardus error vox. Demonstro corroboro apud.
"{'rate': 3, 'label': 'THREE'}","[{'id': None, 'metadata': {'title': 'OF HUMAN BONDAGE', 'pages': 'unknown'}}]","[{'id': 0, 'title': 'PAPER MOON'}, {'id': 0, 'title': 'end'}]",2021-12-18T10:48:32.259+0100,2021-12-12T07:43:44.765+0100,Via cupiditate est. Omnis cribro degero.
"{'rate': 2, 'label': 'TWO'}","[{'id': None, 'metadata': {'title': 'BEYOND THE MEXIQUE BAY', 'pages': 'unknown'}}]","[{'id': 0, 'title': 'end'}, {'id': 0, 'title': 'WITNESS FOR THE PROSECUTION'}]",2021-12-15T19:10:51.225+0100,2021-12-20T11:31:35.470+0100,Vicinus terga capio. Inflammatio deludo varietas.
"{'rate': 3, 'label': 'THREE'}","[{'id': None, 'metadata': {'title': 'BLITHE SPIRIT', 'pages': 'unknown'}}]","[{'id': 0, 'title': 'end'}, {'id': 0, 'title': 'SCARFACE'}]",2021-12-10T12:39:56.558+0100,2021-12-17T19:21:46.137+0100,Consectetur spoliatio patria. Ulciscor collum accedo.
"{'rate': 3, 'label': 'THREE'}","[{'id': None, 'metadata': {'title': 'FROM HERE TO ETERNITY', 'pages': 'unknown'}}]","[{'id': 0, 'title': 'AMERICAN BEAUTY'}, {'id': 0, 'title': 'end'}]",2021-12-27T17:16:51.368+0100,2021-12-21T21:52:47.058+0100,Conicio demulceo convoco. Truculenter auxilium cohors.
"{'rate': 5, 'label': 'FIVE'}","[{'id': None, 'metadata': {'title': 'O JERUSALEM!', 'pages': 'unknown'}}]","[{'id': 0, 'title': 'PATHS OF GLORY'}, {'id': 0, 'title': 'end'}]",2021-12-27T04:03:59.135+0100,2021-12-24T16:28:36.190+0100,Talis tergeo tribuo. Stella unde deprimo.
"{'rate': 3, 'label': 'THREE'}","[{'id': None, 'metadata': {'title': 'THE GOLDEN BOWL', 'pages': 'unknown'}}]","[{'id': 0, 'title': 'end'}, {'id': 0, 'title': 'BLADE RUNNER'}]",2021-12-12T08:43:21.654+0100,2021-12-19T20:31:55.692+0100,Creta tabesco somnus. Ancilla vito fugiat.
"{'rate': 2, 'label': 'TWO'}","[{'id': None, 'metadata': {'title': 'CLOUDS OF WITNESS', 'pages': 'unknown'}}]","[{'id': 0, 'title': 'end'}, {'id': 0, 'title': 'CHINATOWN'}]",2021-12-22T21:28:20.056+0100,2021-12-29T18:23:09.784+0100,Cito tempore verus. Conventus sufficio benigne.
"{'rate': 1, 'label': 'ONE'}","[{'id': None, 'metadata': {'title': 'THE LATHE OF HEAVEN', 'pages': 'unknown'}}]","[{'id': 0, 'title': 'end'}, {'id': 0, 'title': 'CATCH ME IF YOU CAN'}]",2021-12-14T01:53:57.871+0100,2021-12-09T09:05:28.978+0100,Consequuntur rem anser. Voluptatibus subvenio demens.
"{'rate': 5, 'label': 'FIVE'}","[{'id': None, 'metadata': {'title': ""IT'S A BATTLEFIELD"", 'pages': 'unknown'}}]","[{'id': 0, 'title': 'THE BRIDGE ON THE RIVER KWAI'}, {'id': 0, 'title': 'end'}]",2021-12-17T06:04:44.687+0100,2021-12-04T14:14:50.517+0100,Rerum theologus auris. Tabesco vel adamo.
"{'rate': 5, 'label': 'FIVE'}","[{'id': None, 'metadata': {'title': 'I SING THE BODY ELECTRIC', 'pages': 'unknown'}}]","[{'id': 0, 'title': 'end'}, {'id': 0, 'title': 'THE LORD OF THE RINGS: THE TWO TOWERS'}]",2021-12-15T23:10:07.653+0100,2021-12-22T11:07:03.936+0100,Debeo desipio cresco. Velum cotidie aranea.
"{'rate': 5, 'label': 'FIVE'}","[{'id': None, 'metadata': {'title': 'THE YELLOW MEADS OF ASPHODEL', 'pages': 'unknown'}}]","[{'id': 0, 'title': 'THE LORD OF THE RINGS: THE TWO TOWERS'}, {'id': 0, 'title': 'end'}]",2021-12-21T15:29:45.085+0100,2021-12-02T08:43:53.547+0100,Incidunt repellat vinitor. Vesper amet aliqua.
"{'rate': 5, 'label': 'FIVE'}","[{'id': None, 'metadata': {'title': 'AN EVIL CRADLING', 'pages': 'unknown'}}]","[{'id': 0, 'title': 'PAPER MOON'}, {'id': 0, 'title': 'end'}]",2021-12-17T14:59:35.192+0100,2021-12-11T03:11:18.997+0100,Molestiae coruscus tam. Amitto somnus stips.
"{'rate': 4, 'label': 'FOUR'}","[{'id': None, 'metadata': {'title': 'A TIME TO KILL', 'pages': 'unknown'}}]","[{'id': 0, 'title': 'PULP FICTION'}, {'id': 0, 'title': 'end'}]",2021-12-10T02:17:57.928+0100,2021-12-10T19:37:08.212+0100,Confero urbanus ducimus. Culpa tener ustilo.
"{'rate': 2, 'label': 'TWO'}","[{'id': None, 'metadata': {'title': 'THE LAST ENEMY', 'pages': 'unknown'}}]","[{'id': 0, 'title': 'CHINATOWN'}, {'id': 0, 'title': 'end'}]",2021-12-09T12:16:46.955+0100,2021-12-02T15:44:17.636+0100,Clamo volva peior. Apud bellicus rerum.
"{'rate': 5, 'label': 'FIVE'}","[{'id': None, 'metadata': {'title': 'THE PARLIAMENT OF MAN', 'pages': 'unknown'}}]","[{'id': 0, 'title': 'PERSONA'}, {'id': 0, 'title': 'end'}]",2021-12-13T23:04:50.190+0100,2021-12-16T18:06:03.400+0100,Suspendo aufero arto. Inventore derelinquo ut.
"{'rate': 2, 'label': 'TWO'}","[{'id': None, 'metadata': {'title': 'THE LAST ENEMY', 'pages': 'unknown'}}]","[{'id': 0, 'title': 'end'}, {'id': 0, 'title': 'NORTH BY NORTHWEST'}]",2021-12-08T16:42:19.331+0100,2021-12-25T16:34:17.653+0100,Tabella conatus hic. Aut terga qui.
"{'rate': 4, 'label': 'FOUR'}","[{'id': None, 'metadata': {'title': 'RECALLED TO LIFE', 'pages': 'unknown'}}]","[{'id': 0, 'title': 'end'}, {'id': 0, 'title': 'PLATOON'}]",2021-12-05T13:13:13.382+0100,2021-12-01T08:28:43.895+0100,Et curo villa. Decipio vinculum comprehendo.
"{'rate': 4, 'label': 'FOUR'}","[{'id': None, 'metadata': {'title': 'THINGS FALL APART', 'pages': 'unknown'}}]","[{'id': 0, 'title': 'end'}, {'id': 0, 'title': 'GOOD WILL HUNTING'}]",2021-12-11T18:19:15.731+0100,2021-12-18T09:46:05.237+0100,Peccatus temeritas acceptus. Aedificium artificiose atrocitas.
"{'rate': 5, 'label': 'FIVE'}","[{'id': None, 'metadata': {'title': 'MANY WATERS', 'pages': 'unknown'}}]","[{'id': 0, 'title': 'STAR WARS: EPISODE I – THE PHANTOM MENACE'}, {'id': 0, 'title': 'end'}]",2021-12-06T12:05:19.863+0100,2021-12-08T17:04:16.122+0100,Degero aut sunt. Depono ad virga.
"{'rate': 1, 'label': 'ONE'}","[{'id': None, 'metadata': {'title': 'RECALLED TO LIFE', 'pages': 'unknown'}}]","[{'id': 0, 'title': 'end'}, {'id': 0, 'title': 'FORREST GUMP'}]",2021-12-05T00:40:02.101+0100,2021-12-29T21:18:28.610+0100,Cado coepi decerno. Sulum adulescens tui.
"{'rate': 4, 'label': 'FOUR'}","[{'id': None, 'metadata': {'title': 'AN ACCEPTABLE TIME', 'pages': 'unknown'}}]","[{'id': 0, 'title': 'HOW TO TRAIN YOUR DRAGON'}, {'id': 0, 'title': 'end'}]",2021-12-19T00:25:15.260+0100,2021-12-22T03:01:55.511+0100,Vel aut totidem. Vos tribuo voluptatem.
"{'rate': 5, 'label': 'FIVE'}","[{'id': None, 'metadata': {'title': 'SURPRISED BY JOY', 'pages': 'unknown'}}]","[{'id': 0, 'title': 'CITIZEN KANE'}, {'id': 0, 'title': 'end'}]",2021-12-22T09:14:10.473+0100,2021-12-02T16:41:12.497+0100,Quidem varietas curiositas. Cenaculum cito adhuc.
"{'rate': 4, 'label': 'FOUR'}","[{'id': None, 'metadata': {'title': 'THE WEALTH OF NATIONS', 'pages': 'unknown'}}]","[{'id': 0, 'title': 'ALIEN'}, {'id': 0, 'title': 'end'}]",2021-12-23T10:10:43.843+0100,2021-12-22T09:48:37.355+0100,Alius colligo alo. Vel comptus ocer.
"{'rate': 4, 'label': 'FOUR'}","[{'id': None, 'metadata': {'title': 'THE WORLD, THE FLESH AND THE DEVIL', 'pages': 'unknown'}}]","[{'id': 0, 'title': 'end'}, {'id': 0, 'title': 'CATCH ME IF YOU CAN'}]",2021-12-19T20:14:43.880+0100,2021-12-06T00:17:20.900+0100,Terror tametsi fugit. Candidus alias aggero.
"{'rate': 1, 'label': 'ONE'}","[{'id': None, 'metadata': {'title': 'TO YOUR SCATTERED BODIES GO', 'pages': 'unknown'}}]","[{'id': 0, 'title': 'end'}, {'id': 0, 'title': 'THE GODFATHER: PART II'}]",2021-12-26T16:46:25.900+0100,2021-12-15T22:56:55.104+0100,Aeneus quod aggero. Comitatus terga arguo.
"{'rate': 4, 'label': 'FOUR'}","[{'id': None, 'metadata': {'title': 'THAT GOOD NIGHT', 'pages': 'unknown'}}]","[{'id': 0, 'title': 'end'}, {'id': 0, 'title': 'THE PRESTIGE'}]",2021-12-17T21:12:16.142+0100,2021-12-11T06:42:46.109+0100,Cedo alter accendo. Asperiores conatus summisse.
"{'rate': 1, 'label': 'ONE'}","[{'id': None, 'metadata': {'title': 'TO SAY NOTHING OF THE DOG', 'pages': 'unknown'}}]","[{'id': 0, 'title': 'end'}, {'id': 0, 'title': 'THE KID'}]",2021-12-12T04:54:08.118+0100,2021-12-25T18:03:16.670+0100,Sint pecto articulus. Quo tantum copiose.
"{'rate': 5, 'label': 'FIVE'}","[{'id': None, 'metadata': {'title': ""THE MONKEY'S RAINCOAT"", 'pages': 'unknown'}}]","[{'id': 0, 'title': 'end'}, {'id': 0, 'title': 'ALL ABOUT EVE'}]",2021-12-11T13:19:38.324+0100,2021-12-15T04:32:09.590+0100,Amissio ipsum utpote. Reiciendis subiungo tener.
"{'rate': 4, 'label': 'FOUR'}","[{'id': None, 'metadata': {'title': 'A HANDFUL OF DUST', 'pages': 'unknown'}}]","[{'id': 0, 'title': 'LIFE OF BRIAN'}, {'id': 0, 'title': 'end'}]",2021-12-18T22:39:26.929+0100,2021-12-12T16:15:15.281+0100,Apostolus venustas trado. Arcus amo veritas.
"{'rate': 5, 'label': 'FIVE'}","[{'id': None, 'metadata': {'title': 'THE GLORY AND THE DREAM', 'pages': 'unknown'}}]","[{'id': 0, 'title': 'end'}, {'id': 0, 'title': '12 YEARS A SLAVE'}]",2021-12-22T15:19:27.414+0100,2021-12-20T01:20:21.807+0100,Atrocitas timidus damno. Socius tergum votum.
"{'rate': 3, 'label': 'THREE'}","[{'id': None, 'metadata': {'title': 'THE GOLDEN APPLES OF THE SUN', 'pages': 'unknown'}}]","[{'id': 0, 'title': 'end'}, {'id': 0, 'title': 'THE LORD OF THE RINGS: THE FELLOWSHIP OF THE RING'}]",2021-12-03T15:12:40.683+0100,2021-12-27T21:56:54.008+0100,Tricesimus iure culpa. Conor cursus centum.
"{'rate': 5, 'label': 'FIVE'}","[{'id': None, 'metadata': {'title': 'BLITHE SPIRIT', 'pages': 'unknown'}}]","[{'id': 0, 'title': 'THE SILENCE OF THE LAMBS'}, {'id': 0, 'title': 'end'}]",2021-12-20T02:03:16.192+0100,2021-12-08T01:10:53.360+0100,Ulterius utor unde. Caput placeat aegrus.
"{'rate': 1, 'label': 'ONE'}","[{'id': None, 'metadata': {'title': 'WAITING FOR THE BARBARIANS', 'pages': 'unknown'}}]","[{'id': 0, 'title': 'end'}, {'id': 0, 'title': 'LA LA LAND'}]",2021-12-27T03:50:59.968+0100,2021-12-24T17:41:42.615+0100,Ubi pecto ex. Desipio summisse odio.
"{'rate': 5, 'label': 'FIVE'}","[{'id': None, 'metadata': {'title': 'BEYOND THE MEXIQUE BAY', 'pages': 'unknown'}}]","[{'id': 0, 'title': 'TOY STORY 3'}, {'id': 0, 'title': 'end'}]",2021-12-04T01:52:57.897+0100,2021-12-02T15:41:51.562+0100,Clam quis decretum. Quibusdam est sodalitas.
